title,link,pub_date,cleaned_text,sentiment,Date,Open,High,Low,Close,Adj Close,Volume
AMZN vs. GOOG: Which Is The Better Big Tech Stock Today? - TheStreet,https://news.google.com/rss/articles/CBMiW2h0dHBzOi8vd3d3LnRoZXN0cmVldC5jb20vYW1hem9uL25ld3MvYW16bi12cy1nb29nLXdoaWNoLWlzLXRoZS1iZXR0ZXItYmlnLXRlY2gtc3RvY2stdG9kYXnSAQA?oc=5,2021-10-21,amzn vs goog better big tech stock today thestreet,0.25,2021-10-21,142.19200134277344,142.84950256347656,141.63699340820312,142.78050231933594,142.6182098388672,14850000
Download stock Android 12 Wallpapers - HC Newsroom,https://news.google.com/rss/articles/CBMiQ2h0dHBzOi8vd3d3Lmh1YXdlaWNlbnRyYWwuY29tL2Rvd25sb2FkLXN0b2NrLWFuZHJvaWQtMTItd2FsbHBhcGVycy_SAUdodHRwczovL3d3dy5odWF3ZWljZW50cmFsLmNvbS9kb3dubG9hZC1zdG9jay1hbmRyb2lkLTEyLXdhbGxwYXBlcnMvYW1wLw?oc=5,2021-10-21,download stock android 12 wallpapers hc newsroom,0.0,2021-10-21,142.19200134277344,142.84950256347656,141.63699340820312,142.78050231933594,142.6182098388672,14850000
Google Finance becomes easier to use following design overhaul - TechRadar,https://news.google.com/rss/articles/CBMiXWh0dHBzOi8vd3d3LnRlY2hyYWRhci5jb20vbmV3cy9nb29nbGUtZmluYW5jZS1iZWNvbWVzLWVhc2llci10by11c2UtZm9sbG93aW5nLWRlc2lnbi1vdmVyaGF1bNIBAA?oc=5,2021-09-30,google finance becomes easier use following design overhaul techradar,0.0,2021-09-30,134.3249969482422,135.58999633789062,133.0,133.2655029296875,133.11402893066406,35294000
Google Pay app gets reborn as a personal finance assistant - TechRadar,https://news.google.com/rss/articles/CBMiWWh0dHBzOi8vd3d3LnRlY2hyYWRhci5jb20vbmV3cy9nb29nbGUtcGF5LWFwcC1nZXRzLXJlYm9ybi1hcy1hLXBlcnNvbmFsLWZpbmFuY2UtYXNzaXN0YW500gEA?oc=5,2021-09-30,google pay app gets reborn personal finance assistant techradar,0.0,2021-09-30,134.3249969482422,135.58999633789062,133.0,133.2655029296875,133.11402893066406,35294000
Google Discover will soon make it easier to see when your stocks are plummeting - Android Police,https://news.google.com/rss/articles/CBMibmh0dHBzOi8vd3d3LmFuZHJvaWRwb2xpY2UuY29tL2dvb2dsZS1kaXNjb3Zlci13aWxsLXNvb24tbWFrZS1pdC1lYXNpZXItdG8tc2VlLXdoZW4teW91ci1zdG9ja3MtYXJlLXBsdW1tZXRpbmcv0gEA?oc=5,2021-10-04,google discover soon make easier see stocks plummeting android police,0.0,2021-10-04,135.69949340820312,135.6999969482422,131.16650390625,133.76499938964844,133.6129608154297,31530000
Google share price collapses: Alphabet stock down by 2.5% as social media outage hits - Express,https://news.google.com/rss/articles/CBMibWh0dHBzOi8vd3d3LmV4cHJlc3MuY28udWsvZmluYW5jZS9jaXR5LzE1MDA5MTUvR29vZ2xlLXNoYXJlLXByaWNlLWNvbGxhcHNlcy1hbHBoYWJldC1zdG9jay1kb3duLW91dGFnZS1sYXRlc3TSAXFodHRwczovL3d3dy5leHByZXNzLmNvLnVrL2ZpbmFuY2UvY2l0eS8xNTAwOTE1L0dvb2dsZS1zaGFyZS1wcmljZS1jb2xsYXBzZXMtYWxwaGFiZXQtc3RvY2stZG93bi1vdXRhZ2UtbGF0ZXN0L2FtcA?oc=5,2021-10-04,google share price collapses alphabet stock 2 5 social media outage hits express,0.03333333333333333,2021-10-04,135.69949340820312,135.6999969482422,131.16650390625,133.76499938964844,133.6129608154297,31530000
"Google Reports Strong Third-Quarter Advertising Revenue, Shrugging Off Apple Privacy Changes - Forbes",https://news.google.com/rss/articles/CBMijwFodHRwczovL3d3dy5mb3JiZXMuY29tL3NpdGVzL21hcnR5c3dhbnQvMjAyMS8xMC8yNi9nb29nbGUtcmVwb3J0cy1zdHJvbmctdGhpcmQtcXVhcnRlci1hZHZlcnRpc2luZy1yZXZlbnVlLXNocnVnZ2luZy1vZmYtYXBwbGUtcHJpdmFjeS1jaGFuZ2VzL9IBAA?oc=5,2021-10-26,google reports strong third quarter advertising revenue shrugging apple privacy changes forbes,0.21666666666666665,2021-10-26,140.6060028076172,140.83949279785156,139.0054931640625,139.6719970703125,139.51324462890625,28258000
Finding 'Tech' Stocks in a Fund Is Not That Simple - Wealth Management,https://news.google.com/rss/articles/CBMiSWh0dHBzOi8vd3d3LndlYWx0aG1hbmFnZW1lbnQuY29tL2V0ZnMvZmluZGluZy10ZWNoLXN0b2Nrcy1mdW5kLW5vdC1zaW1wbGXSAQA?oc=5,2021-10-26,finding tech stocks fund simple wealth management,0.0,2021-10-26,140.6060028076172,140.83949279785156,139.0054931640625,139.6719970703125,139.51324462890625,28258000
Senators Own up to $25 Million in Big Tech Stocks - Sludge,https://news.google.com/rss/articles/CBMiU2h0dHBzOi8vcmVhZHNsdWRnZS5jb20vMjAyMS8xMC8yNi9zZW5hdG9ycy1vd24tdXAtdG8tMjUtbWlsbGlvbi1pbi1iaWctdGVjaC1zdG9ja3Mv0gEA?oc=5,2021-10-26,senators 25 million big tech stocks sludge,0.0,2021-10-26,140.6060028076172,140.83949279785156,139.0054931640625,139.6719970703125,139.51324462890625,28258000
Google makes waitlists for Pixel 6 Pro because it can't keep the phone in stock - The Verge,https://news.google.com/rss/articles/CBMiV2h0dHBzOi8vd3d3LnRoZXZlcmdlLmNvbS8yMDIxLzEwLzI4LzIyNzUxNTI3L2dvb2dsZS1zdG9yZS1waXhlbC02LXByby13YWl0bGlzdC1pbi1zdG9ja9IBAA?oc=5,2021-10-28,google makes waitlists pixel 6 pro keep phone stock verge,0.0,2021-10-28,147.2989959716797,147.42449951171875,144.7635040283203,146.12899780273438,145.96290588378906,32418000
Google makes waitlists for Pixel 6 Pro because it can't keep the phone in stock - The Verge,https://news.google.com/rss/articles/CBMiV2h0dHBzOi8vd3d3LnRoZXZlcmdlLmNvbS8yMDIxLzEwLzI4LzIyNzUxNTI3L2dvb2dsZS1zdG9yZS1waXhlbC02LXByby13YWl0bGlzdC1pbi1zdG9ja9IBAA?oc=5,2021-10-28,google makes waitlists pixel 6 pro keep phone stock verge,0.0,2021-10-28,147.2989959716797,147.42449951171875,144.7635040283203,146.12899780273438,145.96290588378906,32418000
Google Pixel 6 and 6 Pro: how to buy - The Verge,https://news.google.com/rss/articles/CBMiaGh0dHBzOi8vd3d3LnRoZXZlcmdlLmNvbS8yMjczNDc0OC9nb29nbGUtcGl4ZWwtNi1wcm8tcHJlb3JkZXItYnV5LWhvdy10by1wcmljZS1hdmFpbGFiaWxpdHktcmVsZWFzZS1kYXRl0gEA?oc=5,2021-10-28,google pixel 6 6 pro buy verge,0.0,2021-10-28,147.2989959716797,147.42449951171875,144.7635040283203,146.12899780273438,145.96290588378906,32418000
Google releases Pixel 6 'oriole' and Pixel 6 Pro 'raven' factory images - 9to5Google,https://news.google.com/rss/articles/CBMiOWh0dHBzOi8vOXRvNWdvb2dsZS5jb20vMjAyMS8xMC8yOC9waXhlbC02LWZhY3RvcnktaW1hZ2VzL9IBAA?oc=5,2021-10-28,google releases pixel 6 oriole pixel 6 pro raven factory images 9to5google,0.0,2021-10-28,147.2989959716797,147.42449951171875,144.7635040283203,146.12899780273438,145.96290588378906,32418000
"Ireland's status as tax haven for tech firms like Google, Facebook, and Apple is ending - The Verge",https://news.google.com/rss/articles/CBMiWmh0dHBzOi8vd3d3LnRoZXZlcmdlLmNvbS8yMDIxLzEwLzcvMjI3MTUyMjkvaXJlbGFuZC1zdGF0dXMtdGF4LWhhdmVuLWdvb2dsZS1mYWNlYm9vay1hcHBsZdIBAA?oc=5,2021-10-07,ireland status tax tech firms like google facebook apple ending verge,0.0,2021-10-07,138.86300659179688,140.15444946289062,138.56300354003906,139.1855010986328,139.0272979736328,18250000
Investors eye Big Tech as stock market wobbles - Reuters,https://news.google.com/rss/articles/CBMiWGh0dHBzOi8vd3d3LnJldXRlcnMuY29tL2J1c2luZXNzL2ludmVzdG9ycy1leWUtYmlnLXRlY2gtc3RvY2stbWFya2V0LXdvYmJsZXMtMjAyMS0xMC0wNS_SAQA?oc=5,2021-10-05,investors eye big tech stock market wobbles reuters,0.0,2021-10-05,134.0,137.36199951171875,134.0,136.177001953125,136.022216796875,24126000
Listen: MCG's Andy Nguyen shares his creativity on 'In the Wild' podcast - Jagwire – Augusta,https://news.google.com/rss/articles/CBMiYWh0dHBzOi8vamFnd2lyZS5hdWd1c3RhLmVkdS9saXN0ZW4tbWNncy1hbmR5LW5ndXllbi1zaGFyZXMtaGlzLWNyZWF0aXZpdHktb24taW4tdGhlLXdpbGQtcG9kY2FzdC_SAQA?oc=5,2021-10-05,listen mcg andy nguyen shares creativity wild podcast jagwire augusta,0.1,2021-10-05,134.0,137.36199951171875,134.0,136.177001953125,136.022216796875,24126000
Google Shopping Tip: Find In Stock Items in Nearby Stores - groovyPost,https://news.google.com/rss/articles/CBMiRWh0dHBzOi8vd3d3Lmdyb292eXBvc3QuY29tL2hvd3RvL2dvb2dsZS1zaG9wcGluZy1zZWFyY2gtbmVhcmJ5LTIzMDkyL9IBAA?oc=5,2021-10-27,google shopping tip find stock items nearby stores groovypost,0.0,2021-10-27,139.90249633789062,149.1179962158203,139.90249633789062,146.42750549316406,146.2610626220703,51850000
Google’s parent Alphabet breaches $2 trillion in market value - Al Jazeera English,https://news.google.com/rss/articles/CBMiZ2h0dHBzOi8vd3d3LmFsamF6ZWVyYS5jb20vZWNvbm9teS8yMDIxLzExLzgvZ29vZ2xlcy1wYXJlbnQtYWxwaGFiZXQtYnJlYWNoZXMtMi10cmlsbGlvbi1pbi1tYXJrZXQtdmFsdWXSAWtodHRwczovL3d3dy5hbGphemVlcmEuY29tL2FtcC9lY29ub215LzIwMjEvMTEvOC9nb29nbGVzLXBhcmVudC1hbHBoYWJldC1icmVhY2hlcy0yLXRyaWxsaW9uLWluLW1hcmtldC12YWx1ZQ?oc=5,2021-11-08,google parent alphabet breaches 2 trillion market value al jazeera english,0.0,2021-11-08,150.0,151.0345001220703,149.1199951171875,149.35150146484375,149.18173217773438,18388000
"Google struggles to keep stock of Pixel 6 Pro amid shortage, supply chain hurdles - Moneycontrol",https://news.google.com/rss/articles/CBMiigFodHRwczovL3d3dy5tb25leWNvbnRyb2wuY29tL25ld3MvdGVjaG5vbG9neS9nb29nbGUtc3RydWdnbGVzLXRvLWtlZXAtc3RvY2stb2YtcGl4ZWwtNi1wcm8tYW1pZC1zaG9ydGFnZS1zdXBwbHktY2hhaW4taHVyZGxlcy03NjUwNDcxLmh0bWzSAY4BaHR0cHM6Ly93d3cubW9uZXljb250cm9sLmNvbS9uZXdzL3RlY2hub2xvZ3kvZ29vZ2xlLXN0cnVnZ2xlcy10by1rZWVwLXN0b2NrLW9mLXBpeGVsLTYtcHJvLWFtaWQtc2hvcnRhZ2Utc3VwcGx5LWNoYWluLWh1cmRsZXMtNzY1MDQ3MS5odG1sL2FtcA?oc=5,2021-10-29,google struggles keep stock pixel 6 pro amid shortage supply chain hurdles moneycontrol,0.0,2021-10-29,145.52000427246094,148.61300659179688,145.16650390625,148.27049255371094,148.10195922851562,28954000
Google warns that Pixel 6 Pro is in high demand and is out of stock - Pocketnow,https://news.google.com/rss/articles/CBMiWmh0dHBzOi8vcG9ja2V0bm93LmNvbS9nb29nbGUtd2FybnMtdGhhdC1waXhlbC02LXByby1pcy1pbi1oaWdoLWRlbWFuZC1hbmQtaXMtb3V0LW9mLXN0b2NrL9IBAA?oc=5,2021-10-29,google warns pixel 6 pro high demand stock pocketnow,0.16,2021-10-29,145.52000427246094,148.61300659179688,145.16650390625,148.27049255371094,148.10195922851562,28954000
Google Shares Tips For Optimizing Job Postings - Search Engine Journal,https://news.google.com/rss/articles/CBMiWmh0dHBzOi8vd3d3LnNlYXJjaGVuZ2luZWpvdXJuYWwuY29tL2dvb2dsZS1zaGFyZXMtdGlwcy1mb3Itb3B0aW1pemluZy1qb2ItcG9zdGluZ3MvNDI1NTUxL9IBAA?oc=5,2021-11-01,google shares tips optimizing job postings search engine journal,0.0,2021-11-01,148.1649932861328,148.39950561523438,143.57949829101562,143.7740020751953,143.61058044433594,32272000
"Grayscale-parent Digital Currency Group tops $10 billion valuation with SoftBank, Alphabet investments - CNBC",https://news.google.com/rss/articles/CBMib2h0dHBzOi8vd3d3LmNuYmMuY29tLzIwMjEvMTEvMDEvZGlnaXRhbC1jdXJyZW5jeS1ncm91cC1zZWVzLTEwLWJpbGxpb24tdmFsdWF0aW9uLWFzLXNvZnRiYW5rLWdvb2dsZS1pbnZlc3QuaHRtbNIBc2h0dHBzOi8vd3d3LmNuYmMuY29tL2FtcC8yMDIxLzExLzAxL2RpZ2l0YWwtY3VycmVuY3ktZ3JvdXAtc2Vlcy0xMC1iaWxsaW9uLXZhbHVhdGlvbi1hcy1zb2Z0YmFuay1nb29nbGUtaW52ZXN0Lmh0bWw?oc=5,2021-11-01,grayscale parent digital currency group tops 10 billion valuation softbank alphabet investments cnbc,0.0,2021-11-01,148.1649932861328,148.39950561523438,143.57949829101562,143.7740020751953,143.61058044433594,32272000
Paytm shares fall 27% on trading debut after India's biggest IPO - Financial Times,https://news.google.com/rss/articles/CBMiP2h0dHBzOi8vd3d3LmZ0LmNvbS9jb250ZW50L2MwYmYxMzY5LWM2ZDgtNDkwYy05OTlmLTc2ZTIwNjkwMjZmONIBAA?oc=5,2021-11-18,paytm shares fall 27 trading debut india biggest ipo financial times,0.0,2021-11-18,149.14599609375,151.61000061035156,148.99850463867188,150.70899963378906,150.53768920898438,26658000
Temperature effects on carbon storage are controlled by soil stabilisation capacities - Nature.com,https://news.google.com/rss/articles/CBMiMmh0dHBzOi8vd3d3Lm5hdHVyZS5jb20vYXJ0aWNsZXMvczQxNDY3LTAyMS0yNzEwMS0x0gEA?oc=5,2021-11-18,temperature effects carbon storage controlled soil stabilisation capacities nature com,0.0,2021-11-18,149.14599609375,151.61000061035156,148.99850463867188,150.70899963378906,150.53768920898438,26658000
Google Veteran Patrick Pichette Shares His Top Tips for Founders - Business Insider,https://news.google.com/rss/articles/CBMiTWh0dHBzOi8vd3d3LmJ1c2luZXNzaW5zaWRlci5jb20vZ29vZ2xlLXZjLXBhdHJpY2stcGljaGV0dGUtdGVjaG5vbG9neS0yMDIxLTEx0gEA?oc=5,2021-11-18,google veteran patrick pichette shares top tips founders business insider,0.25,2021-11-18,149.14599609375,151.61000061035156,148.99850463867188,150.70899963378906,150.53768920898438,26658000
GOOG vs. GOOGL: Everything You Need to Know About the Google Stock Split - Yahoo Finance,https://news.google.com/rss/articles/CBMiS2h0dHBzOi8vZmluYW5jZS55YWhvby5jb20vbmV3cy9nb29nLXZzLWdvb2dsLWV2ZXJ5dGhpbmcta25vdy0yMDUyMzc1OTYuaHRtbNIBAA?oc=5,2021-11-19,goog vs googl everything need know google stock split yahoo finance,0.0,2021-11-19,151.0,151.85000610351562,149.8874969482422,149.95249938964844,149.7820587158203,19766000
The 30 Best Stocks of the Past 30 Years - Kiplinger's Personal Finance,https://news.google.com/rss/articles/CBMiVWh0dHBzOi8vd3d3LmtpcGxpbmdlci5jb20vaW52ZXN0aW5nL3N0b2Nrcy82MDM3NzcvMzAtYmVzdC1zdG9ja3Mtb2YtdGhlLXBhc3QtMzAteWVhcnPSAQA?oc=5,2021-11-19,30 best stocks past 30 years kiplinger personal finance,0.25,2021-11-19,151.0,151.85000610351562,149.8874969482422,149.95249938964844,149.7820587158203,19766000
Shop what's trending this holiday season - The Keyword | Google Product and Technology News,https://news.google.com/rss/articles/CBMiPmh0dHBzOi8vYmxvZy5nb29nbGUvcHJvZHVjdHMvc2hvcHBpbmcvdG9wLXRyZW5kaW5nLWdpZnRzLTIwMjEv0gEA?oc=5,2021-11-10,shop trending holiday season keyword google product technology news,0.0,2021-11-10,148.00975036621094,148.6999969482422,145.3249969482422,146.62600708007812,146.4593505859375,22708000
Google India's profit rose 38% to Rs 808 crore in FY21 - Economic Times,https://news.google.com/rss/articles/CBMiggFodHRwczovL2Vjb25vbWljdGltZXMuaW5kaWF0aW1lcy5jb20vdGVjaC90ZWNobm9sb2d5L2dvb2dsZS1pbmRpYXMtcHJvZml0LXJvc2UtMzgtdG8tcnMtODA4LWNyb3JlLWluLWZ5MjEvYXJ0aWNsZXNob3cvODc0OTE0NDkuY21z0gF9aHR0cHM6Ly9tLmVjb25vbWljdGltZXMuY29tL3RlY2gvdGVjaG5vbG9neS9nb29nbGUtaW5kaWFzLXByb2ZpdC1yb3NlLTM4LXRvLXJzLTgwOC1jcm9yZS1pbi1meTIxL2FtcF9hcnRpY2xlc2hvdy84NzQ5MTQ0OS5jbXM?oc=5,2021-11-02,google india profit rose 38 rs 808 crore fy21 economic times,0.4,2021-11-02,144.8094024658203,146.92050170898438,144.64100646972656,145.86300659179688,145.69720458984375,21150000
"Shah Rukh Khan Turns 56: From Bugatti Veyron To BMW i8, A Look At Actor's Luxe Car Collection - Need For Speed - IndiaTimes",https://news.google.com/rss/articles/CBMirgFodHRwczovL20uZWNvbm9taWN0aW1lcy5jb20vbWFnYXppbmVzL3BhbmFjaGUvc2hhaC1ydWtoLWtoYW4tdHVybnMtNTYtZnJvbS1idWdhdHRpLXZleXJvbi10by1ibXctaTgtYS1sb29rLWF0LWFjdG9ycy1sdXhlLWNhci1jb2xsZWN0aW9uL25lZWQtZm9yLXNwZWVkL3NsaWRlc2hvdy84NzQ4MTY3OS5jbXPSAQA?oc=5,2021-11-02,shah rukh khan turns 56 bugatti veyron bmw i8 look actor luxe car collection need speed indiatimes,0.0,2021-11-02,144.8094024658203,146.92050170898438,144.64100646972656,145.86300659179688,145.69720458984375,21150000
How to set up a stock/price alert - WCNC.com,https://news.google.com/rss/articles/CBMilQFodHRwczovL3d3dy53Y25jLmNvbS9hcnRpY2xlL21vbmV5L2hlcmVzLWhvdy10by1zZXQtYS1zdG9ja3ByaWNlLWFsZXJ0LXRvLWdldC13aGF0LXlvdS13YW50LXRvLWJ1eS10aGlzLXllYXIvMjc1LTA5YmI0MDFiLTM4YWItNGE5Yi1iN2RiLTg0ZGY0ZjQyMmUzMdIBAA?oc=5,2021-11-02,set stock price alert wcnc com,0.0,2021-11-02,144.8094024658203,146.92050170898438,144.64100646972656,145.86300659179688,145.69720458984375,21150000
"Sequoia Capital India, 120 angel investors back former Google execs' consumer finance startup Arbo Works - TechCrunch",https://news.google.com/rss/articles/CBMie2h0dHBzOi8vdGVjaGNydW5jaC5jb20vMjAyMS8xMS8xNy9zZXF1b2lhLTEyMC1hbmdlbC1pbnZlc3RvcnMtYmFjay1mb3JtZXItZ29vZ2xlLWV4ZWNzLWNvbnN1bWVyLWZpbmFuY2Utc3RhcnR1cC1hcmJvLXdvcmtzL9IBAA?oc=5,2021-11-17,sequoia capital india 120 angel investors back former google execs consumer finance startup arbo works techcrunch,0.0,2021-11-17,149.22900390625,149.62600708007812,148.56300354003906,149.06199645996094,148.89256286621094,15290000
"Best Mutual Funds Bet On Tech Stocks Nvidia, Salesforce, Microsoft, Google, Netflix - Investor's Business Daily",https://news.google.com/rss/articles/CBMihgFodHRwczovL3d3dy5pbnZlc3RvcnMuY29tL2V0ZnMtYW5kLWZ1bmRzL211dHVhbC1mdW5kcy9iZXN0LW11dHVhbC1mdW5kcy1iZXQtb24tdGVjaC1zdG9ja3MtbnZpZGlhLXNhbGVzZm9yY2UtbWljcm9zb2Z0LWdvb2dsZS1uZXRmbGl4L9IBAA?oc=5,2021-11-05,best mutual funds bet tech stocks nvidia salesforce microsoft google netflix investor business daily,0.5,2021-11-05,149.35350036621094,150.5707550048828,148.65199279785156,149.24099731445312,149.0713653564453,20408000
I'm an Art Director for Google Who Designs the Daily Doodle - Business Insider,https://news.google.com/rss/articles/CBMiVmh0dHBzOi8vd3d3LmJ1c2luZXNzaW5zaWRlci5jb20vZ29vZ2xlLWFydC1kaXJlY3Rvci1kYWlseS1kb29kbGUtd2hhdC1qb2ItbGlrZS0yMDIxLTEx0gEA?oc=5,2021-11-05,art director google designs daily doodle business insider,0.0,2021-11-05,149.35350036621094,150.5707550048828,148.65199279785156,149.24099731445312,149.0713653564453,20408000
Stocks That Move The Stock Market - Forbes,https://news.google.com/rss/articles/CBMiWWh0dHBzOi8vd3d3LmZvcmJlcy5jb20vc2l0ZXMvbWFya2thbnRyb3dpdHovMjAyMS8xMS8xNi9zdG9ja3MtdGhhdC1tb3ZlLXRoZS1zdG9jay1tYXJrZXQv0gEA?oc=5,2021-11-16,stocks move stock market forbes,0.0,2021-11-16,149.17050170898438,149.83250427246094,148.35000610351562,149.0760040283203,148.90655517578125,17254000
Google upgrades Pixel 6 series Bose headphones offer because of stock issues - Notebookcheck.net,https://news.google.com/rss/articles/CBMieGh0dHBzOi8vd3d3Lm5vdGVib29rY2hlY2submV0L0dvb2dsZS11cGdyYWRlcy1QaXhlbC02LXNlcmllcy1Cb3NlLWhlYWRwaG9uZXMtb2ZmZXItYmVjYXVzZS1vZi1zdG9jay1pc3N1ZXMuNTc5Nzc5LjAuaHRtbNIBAA?oc=5,2021-11-16,google upgrades pixel 6 series bose headphones offer stock issues notebookcheck net,0.0,2021-11-16,149.17050170898438,149.83250427246094,148.35000610351562,149.0760040283203,148.90655517578125,17254000
Should you book profits in Sigachi after a rock-solid debut? - Economic Times,https://news.google.com/rss/articles/CBMijQFodHRwczovL2Vjb25vbWljdGltZXMuaW5kaWF0aW1lcy5jb20vbWFya2V0cy9zdG9ja3MvbmV3cy9zaG91bGQteW91LWJvb2stcHJvZml0cy1pbi1zaWdhY2hpLWFmdGVyLWEtcm9jay1zb2xpZC1kZWJ1dC9hcnRpY2xlc2hvdy84NzcxMTM5Mi5jbXPSAYgBaHR0cHM6Ly9tLmVjb25vbWljdGltZXMuY29tL21hcmtldHMvc3RvY2tzL25ld3Mvc2hvdWxkLXlvdS1ib29rLXByb2ZpdHMtaW4tc2lnYWNoaS1hZnRlci1hLXJvY2stc29saWQtZGVidXQvYW1wX2FydGljbGVzaG93Lzg3NzExMzkyLmNtcw?oc=5,2021-11-15,book profits sigachi rock solid debut economic times,0.1,2021-11-15,150.0,150.4770050048828,148.65249633789062,149.38800048828125,149.21820068359375,16248000
Google Is Never Going to Buy BlackBerry - Yahoo Finance,https://news.google.com/rss/articles/CBMiT2h0dHBzOi8vZmluYW5jZS55YWhvby5jb20vbmV3cy9nb29nbGUtbmV2ZXItZ29pbmctYnV5LWJsYWNrYmVycnktMTg1NzM2NjEzLmh0bWzSAQA?oc=5,2021-11-09,google never going buy blackberry yahoo finance,0.0,2021-11-09,149.74600219726562,150.3784942626953,147.5070037841797,149.24850463867188,149.078857421875,16876000
Pixels don't run 'stock Android' and Google needs to give its software skin a public name - Android Police,https://news.google.com/rss/articles/CBMiUmh0dHBzOi8vd3d3LmFuZHJvaWRwb2xpY2UuY29tL2dvb2dsZS1uZWVkcy10by1naXZlLWl0cy1hbmRyb2lkLXNraW4tYS1wdWJsaWMtbmFtZS_SAQA?oc=5,2021-11-09,pixels run stock android google needs give software skin public name android police,0.0,2021-11-09,149.74600219726562,150.3784942626953,147.5070037841797,149.24850463867188,149.078857421875,16876000
Google shares some insight into how the new Face Unblur feature works in Pixel 6 - Scoop Square24,https://news.google.com/rss/articles/CBMiSmh0dHBzOi8vc2Nvb3BzcXVhcmUyNC5jb20vaG93LWZhY2UtdW5ibHVyLWZlYXR1cmUtd29ya3MtaW4tZ29vZ2xlLXBpeGVsLTYv0gFOaHR0cHM6Ly9zY29vcHNxdWFyZTI0LmNvbS9ob3ctZmFjZS11bmJsdXItZmVhdHVyZS13b3Jrcy1pbi1nb29nbGUtcGl4ZWwtNi9hbXAv?oc=5,2021-11-09,google shares insight new face unblur feature works pixel 6 scoop square24,0.13636363636363635,2021-11-09,149.74600219726562,150.3784942626953,147.5070037841797,149.24850463867188,149.078857421875,16876000
'I Could Solve Most of Your Problems': Eric Schmidt's Pentagon Offensive (Published 2020) - The New York Times,https://news.google.com/rss/articles/CBMiT2h0dHBzOi8vd3d3Lm55dGltZXMuY29tLzIwMjAvMDUvMDIvdGVjaG5vbG9neS9lcmljLXNjaG1pZHQtcGVudGFnb24tZ29vZ2xlLmh0bWzSAQA?oc=5,2021-11-03,could solve problems eric schmidt pentagon offensive published 2020 new york times,0.13636363636363635,2021-11-03,146.27499389648438,146.91050720214844,145.05349731445312,146.7899932861328,146.62313842773438,17886000
"'This Is How You Pump A SPAC, Son:' Google Shows Meme Featuring Trump, Ackman Instead Of Logo On DWAC Page - Markets Insider",https://news.google.com/rss/articles/CBMioAFodHRwczovL21hcmtldHMuYnVzaW5lc3NpbnNpZGVyLmNvbS9uZXdzL3N0b2Nrcy90aGlzLWlzLWhvdy15b3UtcHVtcC1hLXNwYWMtc29uLWdvb2dsZS1zaG93cy1tZW1lLWZlYXR1cmluZy10cnVtcC1hY2ttYW4taW5zdGVhZC1vZi1sb2dvLW9uLWR3YWMtcGFnZS0xMDMwOTk2NTE40gEA?oc=5,2021-11-22,pump spac son google shows meme featuring trump ackman instead logo dwac page markets insider,0.0,2021-11-22,150.14175415039062,150.7445068359375,147.0054931640625,147.07850646972656,146.9113311767578,24608000
Profit Alert: Top Ten AI Stocks to Buy This November 2021 - Analytics Insight,https://news.google.com/rss/articles/CBMicWh0dHBzOi8vd3d3LmFuYWx5dGljc2luc2lnaHQubmV0L2FydGlmaWNpYWwtaW50ZWxsaWdlbmNlL3Byb2ZpdC1hbGVydC10b3AtdGVuLWFpLXN0b2Nrcy10by1idXktdGhpcy1ub3ZlbWJlci0yMDIx0gF7aHR0cHM6Ly93d3cuYW5hbHl0aWNzaW5zaWdodC5uZXQvYW1wL3N0b3J5L2FydGlmaWNpYWwtaW50ZWxsaWdlbmNlL3Byb2ZpdC1hbGVydC10b3AtdGVuLWFpLXN0b2Nrcy10by1idXktdGhpcy1ub3ZlbWJlci0yMDIx?oc=5,2021-11-12,profit alert top ten ai stocks buy november 2021 analytics insight,0.25,2021-11-12,147.8314971923828,149.8594970703125,146.45399475097656,149.64549255371094,149.47540283203125,17048000
Where to buy the Google Pixel 6 and Pixel 6 Pro - Android Police,https://news.google.com/rss/articles/CBMiR2h0dHBzOi8vd3d3LmFuZHJvaWRwb2xpY2UuY29tL3doZXJlLXRvLWJ1eS10aGUtcGl4ZWwtNi1hbmQtcGl4ZWwtNi1wcm8v0gEA?oc=5,2021-11-12,buy google pixel 6 pixel 6 pro android police,0.0,2021-11-12,147.8314971923828,149.8594970703125,146.45399475097656,149.64549255371094,149.47540283203125,17048000
NASA's Perseverance Mars Rover Spots Something 'No One's Ever Seen' - Gadgets 360,https://news.google.com/rss/articles/CBMiiwFodHRwczovL3d3dy5nYWRnZXRzMzYwLmNvbS9zY2llbmNlL25ld3MvbWFycy1wZXJzZXZlcmFuY2UtbmFzYS1yb3Zlci1kaWctc3BvdC1uZXZlci1iZWZvcmUtc2Vlbi1zb2lsLW1hcnRpYW4tbGlmZS13YXRlci1waG90by1pbWFnZS0yNjA2NjEy0gEA?oc=5,2021-11-11,nasa perseverance mars rover spots something one ever seen gadgets 360,0.0,2021-11-11,147.10699462890625,148.5022430419922,146.6945037841797,146.7480010986328,146.58119201660156,12464000
How to gesture your way around your Android phone - Popular Science,https://news.google.com/rss/articles/CBMiMmh0dHBzOi8vd3d3LnBvcHNjaS5jb20vYW5kcm9pZC1nZXN0dXJlLW5hdmlnYXRpb24v0gEA?oc=5,2021-11-11,gesture way around android phone popular science,0.6,2021-11-11,147.10699462890625,148.5022430419922,146.6945037841797,146.7480010986328,146.58119201660156,12464000
"Stock Market Investing: 5 Ways to Prep for a Rocky End to 2021, BofA - Business Insider",https://news.google.com/rss/articles/CBMibWh0dHBzOi8vd3d3LmJ1c2luZXNzaW5zaWRlci5jb20vc3RvY2stbWFya2V0LWludmVzdGluZy1iYW5rLW9mLWFtZXJpY2EtcHJlcGFyZS1wb3J0Zm9saW8tdmFsdWUtZ3Jvd3RoLTIwMjEtMTHSAQA?oc=5,2021-11-04,stock market investing 5 ways prep rocky end 2021 bofa business insider,0.0,2021-11-04,147.1999969482422,149.9499969482422,146.63499450683594,148.68299865722656,148.5139923095703,24700000
"Califf, Biden's FDA pick, has millions invested in pharma, tech companies - STAT",https://news.google.com/rss/articles/CBMiQGh0dHBzOi8vd3d3LnN0YXRuZXdzLmNvbS8yMDIxLzExLzIzL2NhbGlmZi1taWxsaW9ucy1waGFybWEtdGVjaC_SAQA?oc=5,2021-11-23,califf biden fda pick millions invested pharma tech companies stat,0.0,2021-11-23,147.11300659179688,147.69400024414062,144.88949584960938,146.7570037841797,146.59019470214844,18126000
Google searches show popular Thanksgiving dishes in every state - USA TODAY,https://news.google.com/rss/articles/CBMiamh0dHBzOi8vd3d3LnVzYXRvZGF5LmNvbS9zdG9yeS9uZXdzL25hdGlvbi8yMDIxLzExLzIzLzIwMjEtZ29vZ2xlLXNlYXJjaGVzLXRoYW5rc2dpdmluZy1kaXNoZXMvODcyNjU3NTAwMi_SAQA?oc=5,2021-11-23,google searches show popular thanksgiving dishes every state usa today,0.6,2021-11-23,147.11300659179688,147.69400024414062,144.88949584960938,146.7570037841797,146.59019470214844,18126000
Alphabet was the top Big Tech stock of the year — here's why - CNBC,https://news.google.com/rss/articles/CBMiXmh0dHBzOi8vd3d3LmNuYmMuY29tLzIwMjEvMTIvMjcvYWxwaGFiZXQtd2FzLXRoZS10b3AtYmlnLXRlY2gtc3RvY2stb2YtdGhlLXllYXItaGVyZXMtd2h5Lmh0bWzSAWJodHRwczovL3d3dy5jbmJjLmNvbS9hbXAvMjAyMS8xMi8yNy9hbHBoYWJldC13YXMtdGhlLXRvcC1iaWctdGVjaC1zdG9jay1vZi10aGUteWVhci1oZXJlcy13aHkuaHRtbA?oc=5,2021-12-27,alphabet top big tech stock year cnbc,0.25,2021-12-27,147.4635009765625,148.42649841308594,147.25,148.06399536132812,147.89569091796875,13256000
"Tesla, Apple, Google, Netflix, Amazon: Which Stocks Should You Own? - Forbes",https://news.google.com/rss/articles/CBMiX2h0dHBzOi8vd3d3LmZvcmJlcy5jb20vc2l0ZXMvam9obmRvcmZtYW4vMjAyMS8xMi8yNy9hcHBsZS1nb29nbGUtdGVzbGEtZmFjZWJvb2stbmV0ZmxpeC1zdG9ja3Mv0gEA?oc=5,2021-12-27,tesla apple google netflix amazon stocks forbes,0.0,2021-12-27,147.4635009765625,148.42649841308594,147.25,148.06399536132812,147.89569091796875,13256000
"Best Blockchain ETFs, Rated and Reviewed for 2022 - Bitcoin Market Journal",https://news.google.com/rss/articles/CBMiNWh0dHBzOi8vd3d3LmJpdGNvaW5tYXJrZXRqb3VybmFsLmNvbS9ibG9ja2NoYWluLWV0ZnMv0gEA?oc=5,2021-12-27,best blockchain etfs rated reviewed 2022 bitcoin market journal,1.0,2021-12-27,147.4635009765625,148.42649841308594,147.25,148.06399536132812,147.89569091796875,13256000
Alphabet was the top Big Tech stock of the year — here's why - CNBC,https://news.google.com/rss/articles/CBMiXmh0dHBzOi8vd3d3LmNuYmMuY29tLzIwMjEvMTIvMjcvYWxwaGFiZXQtd2FzLXRoZS10b3AtYmlnLXRlY2gtc3RvY2stb2YtdGhlLXllYXItaGVyZXMtd2h5Lmh0bWzSAWJodHRwczovL3d3dy5jbmJjLmNvbS9hbXAvMjAyMS8xMi8yNy9hbHBoYWJldC13YXMtdGhlLXRvcC1iaWctdGVjaC1zdG9jay1vZi10aGUteWVhci1oZXJlcy13aHkuaHRtbA?oc=5,2021-12-27,alphabet top big tech stock year cnbc,0.25,2021-12-27,147.4635009765625,148.42649841308594,147.25,148.06399536132812,147.89569091796875,13256000
