title,link,pub_date,cleaned_text,sentiment,Date,Open,High,Low,Close,Adj Close,Volume
How Much Does Google (GOOGL) CEO Sundar Pichai Get Paid? - Bloomberg,https://news.google.com/rss/articles/CBMicWh0dHBzOi8vd3d3LmJsb29tYmVyZy5jb20vbmV3cy9hcnRpY2xlcy8yMDIzLTA0LTIxL2FscGhhYmV0LWNlby1zLXBheS1zb2Fycy10by0yMjYtbWlsbGlvbi1vbi1tYXNzaXZlLXN0b2NrLWF3YXJk0gEA?oc=5,2023-04-21,much google googl ceo sundar pichai get paid bloomberg,0.2,2023-04-21,106.08999633789062,106.63999938964844,105.48500061035156,105.91000366210938,105.78961944580078,22379000
3 IPOs to Watch to Find the Next Google Stock - Yahoo Finance,https://news.google.com/rss/articles/CBMiRmh0dHBzOi8vZmluYW5jZS55YWhvby5jb20vbmV3cy8zLWlwb3Mtd2F0Y2gtbmV4dC1nb29nbGUtMTAyNTQwNTA0Lmh0bWzSAQA?oc=5,2023-04-21,3 ipos watch find next google stock yahoo finance,0.0,2023-04-21,106.08999633789062,106.63999938964844,105.48500061035156,105.91000366210938,105.78961944580078,22379000
Google CEO Pichai’s $226M Pay Package Boosted By Stock Awards - CRN,https://news.google.com/rss/articles/CBMiW2h0dHBzOi8vd3d3LmNybi5jb20vbmV3cy9jbG91ZC9nb29nbGUtY2VvLXBpY2hhaS1zLTIyNm0tcGF5LXBhY2thZ2UtYm9vc3RlZC1ieS1zdG9jay1hd2FyZHPSAQA?oc=5,2023-04-21,google ceo pichai 226m pay package boosted stock awards crn,0.0,2023-04-21,106.08999633789062,106.63999938964844,105.48500061035156,105.91000366210938,105.78961944580078,22379000
How Much Does Google (GOOGL) CEO Sundar Pichai Get Paid? - Bloomberg,https://news.google.com/rss/articles/CBMicWh0dHBzOi8vd3d3LmJsb29tYmVyZy5jb20vbmV3cy9hcnRpY2xlcy8yMDIzLTA0LTIxL2FscGhhYmV0LWNlby1zLXBheS1zb2Fycy10by0yMjYtbWlsbGlvbi1vbi1tYXNzaXZlLXN0b2NrLWF3YXJk0gEA?oc=5,2023-04-21,much google googl ceo sundar pichai get paid bloomberg,0.2,2023-04-21,106.08999633789062,106.63999938964844,105.48500061035156,105.91000366210938,105.78961944580078,22379000
3 IPOs to Watch to Find the Next Google Stock - Yahoo Finance,https://news.google.com/rss/articles/CBMiRmh0dHBzOi8vZmluYW5jZS55YWhvby5jb20vbmV3cy8zLWlwb3Mtd2F0Y2gtbmV4dC1nb29nbGUtMTAyNTQwNTA0Lmh0bWzSAQA?oc=5,2023-04-21,3 ipos watch find next google stock yahoo finance,0.0,2023-04-21,106.08999633789062,106.63999938964844,105.48500061035156,105.91000366210938,105.78961944580078,22379000
How to Buy Google Stock - Money,https://news.google.com/rss/articles/CBMiLGh0dHBzOi8vbW9uZXkuY29tL2hvdy10by1idXktYWxwaGFiZXQtc3RvY2sv0gEA?oc=5,2023-03-31,buy google stock money,0.0,2023-03-31,101.70999908447266,104.19000244140624,101.44000244140624,104.0,103.8817901611328,28108000
How to Track Stocks in Google Sheets - Make Tech Easier,https://news.google.com/rss/articles/CBMiOmh0dHBzOi8vd3d3Lm1ha2V0ZWNoZWFzaWVyLmNvbS90cmFjay1zdG9ja3MtZ29vZ2xlLXNoZWV0cy_SAQA?oc=5,2023-03-29,track stocks google sheets make tech easier,0.0,2023-03-29,102.72000122070312,102.81999969482422,101.02999877929688,101.9000015258789,101.78417205810548,26148300
Google shares insights from Malaysian parents' thoughts on online safety - TechNave,https://news.google.com/rss/articles/CBMibmh0dHBzOi8vdGVjaG5hdmUuY29tL2dhZGdldC9Hb29nbGUtc2hhcmVzLWluc2lnaHRzLWZyb20tTWFsYXlzaWFuLXBhcmVudHMtdGhvdWdodHMtb24tb25saW5lLXNhZmV0eS0zMzkzNi5odG1s0gEA?oc=5,2023-03-30,google shares insights malaysian parents thoughts online safety technave,0.0,2023-03-30,101.44000244140624,101.61000061035156,100.29000091552734,101.31999969482422,101.204833984375,25009800
Google Insiders Are $9 Billion Richer After AI-Fueled Stock Rally - Forbes,https://news.google.com/rss/articles/CBMic2h0dHBzOi8vd3d3LmZvcmJlcy5jb20vc2l0ZXMvZGVyZWtzYXVsLzIwMjMvMDUvMTEvZ29vZ2xlLWluc2lkZXJzLWFyZS05LWJpbGxpb24tcmljaGVyLWFmdGVyLWFpLWZ1ZWxlZC1zdG9jay1yYWxseS_SAQA?oc=5,2023-05-11,google insiders 9 billion richer ai fueled stock rally forbes,0.0,2023-05-11,115.86000061035156,118.44000244140624,114.93000030517578,116.9000015258789,116.76712799072266,57115100
Alphabet trading at highest since August as Wall Street cheers Google's A.I. plans - CNBC,https://news.google.com/rss/articles/CBMiZ2h0dHBzOi8vd3d3LmNuYmMuY29tLzIwMjMvMDUvMTEvZ29vZ2xlLWFpLWV2ZW50LXNlbmRzLWFscGhhYmV0LXN0b2NrLXRvLWhpZ2hlc3QtcHJpY2Utc2luY2UtYXVndXN0Lmh0bWzSAWtodHRwczovL3d3dy5jbmJjLmNvbS9hbXAvMjAyMy8wNS8xMS9nb29nbGUtYWktZXZlbnQtc2VuZHMtYWxwaGFiZXQtc3RvY2stdG8taGlnaGVzdC1wcmljZS1zaW5jZS1hdWd1c3QuaHRtbA?oc=5,2023-05-11,alphabet trading highest since august wall street cheers google plans cnbc,0.0,2023-05-11,115.86000061035156,118.44000244140624,114.93000030517578,116.9000015258789,116.76712799072266,57115100
Alphabet Gains $131 Billion in Market Value After It Unveils AI Ambitions - Markets Insider,https://news.google.com/rss/articles/CBMihAFodHRwczovL21hcmtldHMuYnVzaW5lc3NpbnNpZGVyLmNvbS9uZXdzL3N0b2Nrcy9hbHBoYWJldC1zdG9jay1wcmljZS1nb29nbGUtc2VhcmNoLWFpLXNuYXBzaG90cy1hcnRpZmljaWFsLWludGVsbGlnZW5jZS1nb29nbC0yMDIzLTXSAQA?oc=5,2023-05-11,alphabet gains 131 billion market value unveils ai ambitions markets insider,0.0,2023-05-11,115.86000061035156,118.44000244140624,114.93000030517578,116.9000015258789,116.76712799072266,57115100
"Dow Jones Futures Fall: Nasdaq Steps Up, But PacWest Dives On Deposit Slide - Investor's Business Daily",https://news.google.com/rss/articles/CBMiemh0dHBzOi8vd3d3LmludmVzdG9ycy5jb20vbWFya2V0LXRyZW5kL3N0b2NrLW1hcmtldC10b2RheS9kb3ctam9uZXMtZnV0dXJlcy1uYXNkYXEtaGl0cy0yMDIzLWhpZ2gtZ29vZ2xlLWp1bXBzLW9uLWFpLXB1c2gv0gEA?oc=5,2023-05-11,dow jones futures fall nasdaq steps pacwest dives deposit slide investor business daily,0.0,2023-05-11,115.86000061035156,118.44000244140624,114.93000030517578,116.9000015258789,116.76712799072266,57115100
Google surges by $82 billion overnight - news.com.au,https://news.google.com/rss/articles/CBMipQFodHRwczovL3d3dy5uZXdzLmNvbS5hdS9maW5hbmNlL2J1c2luZXNzL3RlY2hub2xvZ3kvZ29vZ2xlLXNoYXJlcy1zdXJnZS1ieS04Mi1iaWxsaW9uLW92ZXJuaWdodC1mb2xsb3dpbmctYWktYW5ub3VuY2VtZW50L25ld3Mtc3RvcnkvM2Y1MGZiYWU3YTQ3Mzc5NmMyYzlhNGZlZjY2MWU4ZDPSAakBaHR0cHM6Ly93d3cubmV3cy5jb20uYXUvZmluYW5jZS9idXNpbmVzcy90ZWNobm9sb2d5L2dvb2dsZS1zaGFyZXMtc3VyZ2UtYnktODItYmlsbGlvbi1vdmVybmlnaHQtZm9sbG93aW5nLWFpLWFubm91bmNlbWVudC9uZXdzLXN0b3J5LzNmNTBmYmFlN2E0NzM3OTZjMmM5YTRmZWY2NjFlOGQzP2FtcA?oc=5,2023-05-11,google surges 82 billion overnight news com au,0.0,2023-05-11,115.86000061035156,118.44000244140624,114.93000030517578,116.9000015258789,116.76712799072266,57115100
"Google Bard, ChatGPT giving stock ideas. But should investors say aye to AI? - IndiaTimes",https://news.google.com/rss/articles/CBMikwFodHRwczovL20uZWNvbm9taWN0aW1lcy5jb20vbWFya2V0cy9zdG9ja3MvbmV3cy9nb29nbGUtYmFyZC1jaGF0Z3B0LWdpdmluZy1zdG9jay1pZGVhcy1idXQtc2hvdWxkLWludmVzdG9ycy1zYXktYXllLXRvLWFpL2FydGljbGVzaG93LzEwMDM0NTgyNi5jbXPSAZcBaHR0cHM6Ly9tLmVjb25vbWljdGltZXMuY29tL21hcmtldHMvc3RvY2tzL25ld3MvZ29vZ2xlLWJhcmQtY2hhdGdwdC1naXZpbmctc3RvY2staWRlYXMtYnV0LXNob3VsZC1pbnZlc3RvcnMtc2F5LWF5ZS10by1haS9hbXBfYXJ0aWNsZXNob3cvMTAwMzQ1ODI2LmNtcw?oc=5,2023-05-19,google bard chatgpt giving stock ideas investors say aye ai indiatimes,0.0,2023-05-19,124.1999969482422,126.47899627685548,122.72000122070312,123.25,123.1099090576172,30251300
Our Pick Of The Best Cannabis Stocks – Forbes Advisor UK - Forbes,https://news.google.com/rss/articles/CBMiQWh0dHBzOi8vd3d3LmZvcmJlcy5jb20vdWsvYWR2aXNvci9pbnZlc3RpbmcvYmVzdC1jYW5uYWJpcy1zdG9ja3Mv0gEA?oc=5,2023-05-19,pick best cannabis stocks forbes advisor uk forbes,1.0,2023-05-19,124.1999969482422,126.47899627685548,122.72000122070312,123.25,123.1099090576172,30251300
GOOGL Stock Pops On AI News At Google I/O 2023 - Investor's Business Daily,https://news.google.com/rss/articles/CBMiWGh0dHBzOi8vd3d3LmludmVzdG9ycy5jb20vbmV3cy90ZWNobm9sb2d5L2dvb2dsLXN0b2NrLXBvcHMtb24tYWktbmV3cy1hdC1nb29nbGUtaW8tMjAyMy_SAQA?oc=5,2023-05-10,googl stock pops ai news google 2023 investor business daily,0.0,2023-05-10,108.5500030517578,113.51000213623048,108.4800033569336,112.27999877929688,112.15237426757812,47533500
"Here's everything Google just announced: A $1,799 folding phone, A.I. in Search and more - CNBC",https://news.google.com/rss/articles/CBMiQGh0dHBzOi8vd3d3LmNuYmMuY29tLzIwMjMvMDUvMTAvZ29vZ2xlLWlvLTIwMjMtbGl2ZS11cGRhdGVzLmh0bWzSAURodHRwczovL3d3dy5jbmJjLmNvbS9hbXAvMjAyMy8wNS8xMC9nb29nbGUtaW8tMjAyMy1saXZlLXVwZGF0ZXMuaHRtbA?oc=5,2023-05-10,everything google announced 1 799 folding phone search cnbc,0.0,2023-05-10,108.5500030517578,113.51000213623048,108.4800033569336,112.27999877929688,112.15237426757812,47533500
"Google IO 2023: (GOOGL) Stock Rises on Bard AI, Search Labs Reveal - Bloomberg",https://news.google.com/rss/articles/CBMicWh0dHBzOi8vd3d3LmJsb29tYmVyZy5jb20vbmV3cy9hcnRpY2xlcy8yMDIzLTA1LTEwL2dvb2dsZS10by1yZXZhbXAtc2VhcmNoLXdpdGgtZ2VuZXJhdGl2ZS1haS10b29scy1idXQtZ3JhZHVhbGx50gEA?oc=5,2023-05-10,google io 2023 googl stock rises bard ai search labs reveal bloomberg,0.0,2023-05-10,108.5500030517578,113.51000213623048,108.4800033569336,112.27999877929688,112.15237426757812,47533500
"Google Bard will work with images, more apps as company pushes generative AI - Yahoo Finance",https://news.google.com/rss/articles/CBMieWh0dHBzOi8vZmluYW5jZS55YWhvby5jb20vbmV3cy9nb29nbGUtYmFyZC13aWxsLXdvcmstd2l0aC1pbWFnZXMtbW9yZS1hcHBzLWFzLWNvbXBhbnktcHVzaGVzLWdlbmVyYXRpdmUtYWktMTc0NTAwNzAyLmh0bWzSAQA?oc=5,2023-05-10,google bard work images apps company pushes generative ai yahoo finance,0.0,2023-05-10,108.5500030517578,113.51000213623048,108.4800033569336,112.27999877929688,112.15237426757812,47533500
Google Search is getting generative AI in strike at Microsoft - Yahoo Finance,https://news.google.com/rss/articles/CBMia2h0dHBzOi8vZmluYW5jZS55YWhvby5jb20vbmV3cy9nb29nbGUtc2VhcmNoLWlzLWdldHRpbmctZ2VuZXJhdGl2ZS1haS1pbi1zdHJpa2UtYXQtbWljcm9zb2Z0LTE4MDgyNDU3Ny5odG1s0gEA?oc=5,2023-05-10,google search getting generative ai strike microsoft yahoo finance,0.0,2023-05-10,108.5500030517578,113.51000213623048,108.4800033569336,112.27999877929688,112.15237426757812,47533500
Google shares unlisted YouTube video to reveal more about Pixel Fold - Neowin,https://news.google.com/rss/articles/CBMiYWh0dHBzOi8vd3d3Lm5lb3dpbi5uZXQvbmV3cy9nb29nbGUtc2hhcmVzLXVubGlzdGVkLXlvdXR1YmUtdmlkZW8tdG8tcmV2ZWFsLW1vcmUtYWJvdXQtcGl4ZWwtZm9sZC_SAWBodHRwczovL3d3dy5uZW93aW4ubmV0L2FtcC9nb29nbGUtc2hhcmVzLXVubGlzdGVkLXlvdXR1YmUtdmlkZW8tdG8tcmV2ZWFsLW1vcmUtYWJvdXQtcGl4ZWwtZm9sZC8?oc=5,2023-05-10,google shares unlisted youtube video reveal pixel fold neowin,0.0,2023-05-10,108.5500030517578,113.51000213623048,108.4800033569336,112.27999877929688,112.15237426757812,47533500
Google Billionaire Sergey Brin Gifts $600 Million in Surging Shares - Bloomberg,https://news.google.com/rss/articles/CBMibmh0dHBzOi8vd3d3LmJsb29tYmVyZy5jb20vbmV3cy9hcnRpY2xlcy8yMDIzLTA1LTE1L2dvb2dsZS1iaWxsaW9uYWlyZS1icmluLWdpZnRzLTYwMC1taWxsaW9uLWluLXN1cmdpbmctc2hhcmVz0gEA?oc=5,2023-05-15,google billionaire sergey brin gifts 600 million surging shares bloomberg,0.0,2023-05-15,116.48999786376952,118.79499816894533,116.4800033569336,116.95999908447266,116.82705688476562,22107900
End Of Google's Dominance? Stock Gets Rare Analyst Downgrade Over AI Fears - Forbes,https://news.google.com/rss/articles/CBMie2h0dHBzOi8vd3d3LmZvcmJlcy5jb20vc2l0ZXMvZGVyZWtzYXVsLzIwMjMvMDUvMTUvZW5kLW9mLWdvb2dsZXMtZG9taW5hbmNlLXN0b2NrLWdldHMtcmFyZS1hbmFseXN0LWRvd25ncmFkZS1vdmVyLWFpLWZlYXJzL9IBAA?oc=5,2023-05-15,end google dominance stock gets rare analyst downgrade ai fears forbes,0.3,2023-05-15,116.48999786376952,118.79499816894533,116.4800033569336,116.95999908447266,116.82705688476562,22107900
Google Co-founders Get Richer By $18 Billion In A Week As Alphabet Stock Soars 11% Amid AI Push - Indiatimes.com,https://news.google.com/rss/articles/CBMigAFodHRwczovL3d3dy5pbmRpYXRpbWVzLmNvbS93b3J0aC9uZXdzL2dvb2dsZS1jby1mb3VuZGVycy1nZXQtcmljaGVyLWJ5LTE4LWJpbGxpb24tYXMtYWxwaGFiZXQtc3RvY2stc29hcnMtMTEtcGVyY2VudC02MDI1NzEuaHRtbNIBhAFodHRwczovL3d3dy5pbmRpYXRpbWVzLmNvbS9hbXAvd29ydGgvbmV3cy9nb29nbGUtY28tZm91bmRlcnMtZ2V0LXJpY2hlci1ieS0xOC1iaWxsaW9uLWFzLWFscGhhYmV0LXN0b2NrLXNvYXJzLTExLXBlcmNlbnQtNjAyNTcxLmh0bWw?oc=5,2023-05-15,google co founders get richer 18 billion week alphabet stock soars 11 amid ai push indiatimes com,0.0,2023-05-15,116.48999786376952,118.79499816894533,116.4800033569336,116.95999908447266,116.82705688476562,22107900
"Stocks mixed after strong results from Microsoft, Google: Stock market news today - Yahoo Finance",https://news.google.com/rss/articles/CBMiYGh0dHBzOi8vZmluYW5jZS55YWhvby5jb20vbmV3cy9zdG9jay1tYXJrZXQtbmV3cy10b2RheS1saXZlLXVwZGF0ZXMtYXByaWwtMjYtMjAyMy0xMjA1MTIzODcuaHRtbNIBAA?oc=5,2023-04-26,stocks mixed strong results microsoft google stock market news today yahoo finance,0.21666666666666665,2023-04-26,105.55999755859376,107.0199966430664,103.2699966430664,104.4499969482422,104.3312759399414,37068200
"Alphabet’s Q1 topline, bottomline beat Street; $70 billion share buyback announced - IndiaTimes",https://news.google.com/rss/articles/CBMihQFodHRwczovL20uZWNvbm9taWN0aW1lcy5jb20vdGVjaC90ZWNobm9sb2d5L2FscGhhYmV0LXExLXJlc3VsdHMtZ29vZ2xlLXBhcmVudHMtcmV2ZW51ZS1yaXNlcy10by02OS04LWJpbGxpb24vYXJ0aWNsZXNob3cvOTk3Njk1NDQuY21z0gGJAWh0dHBzOi8vbS5lY29ub21pY3RpbWVzLmNvbS90ZWNoL3RlY2hub2xvZ3kvYWxwaGFiZXQtcTEtcmVzdWx0cy1nb29nbGUtcGFyZW50cy1yZXZlbnVlLXJpc2VzLXRvLTY5LTgtYmlsbGlvbi9hbXBfYXJ0aWNsZXNob3cvOTk3Njk1NDQuY21z?oc=5,2023-04-26,alphabet q1 topline bottomline beat street 70 billion share buyback announced indiatimes,0.0,2023-04-26,105.55999755859376,107.0199966430664,103.2699966430664,104.4499969482422,104.3312759399414,37068200
Microsoft 'holding a lot of the cards' in AI-powered search war with Google - Yahoo Finance,https://news.google.com/rss/articles/CBMid2h0dHBzOi8vZmluYW5jZS55YWhvby5jb20vbmV3cy9taWNyb3NvZnQtaG9sZGluZy1hLWxvdC1vZi10aGUtY2FyZHMtaW4tYWktcG93ZXJlZC1zZWFyY2gtd2FyLXdpdGgtZ29vZ2xlLTE3MTYxMjQ4Ny5odG1s0gEA?oc=5,2023-04-26,microsoft holding lot cards ai powered search war google yahoo finance,0.0,2023-04-26,105.55999755859376,107.0199966430664,103.2699966430664,104.4499969482422,104.3312759399414,37068200
Alphabet's stock rises as earnings show Google ad sales holding steady - MarketWatch,https://news.google.com/rss/articles/CBMib2h0dHBzOi8vd3d3Lm1hcmtldHdhdGNoLmNvbS9zdG9yeS9hbHBoYWJldHMtc3RvY2stcmlzZXMtYXMtZWFybmluZ3Mtc2hvdy1nb29nbGUtYWQtc2FsZXMtaG9sZGluZy1zdGVhZHktOWQ5ZWYxNNIBc2h0dHBzOi8vd3d3Lm1hcmtldHdhdGNoLmNvbS9hbXAvc3RvcnkvYWxwaGFiZXRzLXN0b2NrLXJpc2VzLWFzLWVhcm5pbmdzLXNob3ctZ29vZ2xlLWFkLXNhbGVzLWhvbGRpbmctc3RlYWR5LTlkOWVmMTQ?oc=5,2023-04-26,alphabet stock rises earnings show google ad sales holding steady marketwatch,0.16666666666666666,2023-04-26,105.55999755859376,107.0199966430664,103.2699966430664,104.4499969482422,104.3312759399414,37068200
"Microsoft, Google just told us AI is for real, right now. Here's a broad selection of stocks that will benefit - CNBC",https://news.google.com/rss/articles/CBMijwFodHRwczovL3d3dy5jbmJjLmNvbS8yMDIzLzA0LzI2L21pY3Jvc29mdC1nb29nbGUtanVzdC10b2xkLXVzLWFpLWlzLWZvci1yZWFsLXJpZ2h0LW5vdy1oZXJlcy1hLWJyb2FkLXNlbGVjdGlvbi1vZi1zdG9ja3MtdGhhdC13aWxsLWJlbmVmaXQuaHRtbNIBAA?oc=5,2023-04-26,microsoft google told us ai real right broad selection stocks benefit cnbc,0.24553571428571427,2023-04-26,105.55999755859376,107.0199966430664,103.2699966430664,104.4499969482422,104.3312759399414,37068200
Google parent Alphabet announces stock buyback after modest beat on ad sales - CityAM - City A.M.,https://news.google.com/rss/articles/CBMiZGh0dHBzOi8vd3d3LmNpdHlhbS5jb20vZ29vZ2xlLXBhcmVudC1hbHBoYWJldC1hbm5vdW5jZXMtc3RvY2stYnV5YmFjay1hZnRlci1tb2Rlc3QtYmVhdC1vbi1hZC1zYWxlcy_SAQA?oc=5,2023-04-26,google parent alphabet announces stock buyback modest beat ad sales cityam city,0.1,2023-04-26,105.55999755859376,107.0199966430664,103.2699966430664,104.4499969482422,104.3312759399414,37068200
Google and Microsoft fight over the future of AI - CNN,https://news.google.com/rss/articles/CBMiTGh0dHBzOi8vd3d3LmNubi5jb20vMjAyMy8wNC8yNi9pbnZlc3RpbmcvcHJlbWFya2V0LXN0b2Nrcy10cmFkaW5nL2luZGV4Lmh0bWzSAUVodHRwczovL2FtcC5jbm4uY29tL2Nubi8yMDIzLzA0LzI2L2ludmVzdGluZy9wcmVtYXJrZXQtc3RvY2tzLXRyYWRpbmc?oc=5,2023-04-26,google microsoft fight future ai cnn,0.0,2023-04-26,105.55999755859376,107.0199966430664,103.2699966430664,104.4499969482422,104.3312759399414,37068200
Shares of Google parent Alphabet jump after $70bn stock buyback pledge - The National,https://news.google.com/rss/articles/CBMiXGh0dHBzOi8vd3d3LnRoZW5hdGlvbmFsbmV3cy5jb20vYnVzaW5lc3MvdGVjaG5vbG9neS8yMDIzLzA0LzI2L2dvb2dsZS1hbHBoYWJldC1zaGFyZXMtc3RvY2sv0gEA?oc=5,2023-04-26,shares google parent alphabet jump 70bn stock buyback pledge national,0.0,2023-04-26,105.55999755859376,107.0199966430664,103.2699966430664,104.4499969482422,104.3312759399414,37068200
"If You Invested $1,000 in Google Stock When It Acquired YouTube, Here's How Much You'd Have Today - Alpha - Benzinga",https://news.google.com/rss/articles/CBMilwFodHRwczovL3d3dy5iZW56aW5nYS5jb20vZ2VuZXJhbC9lZHVjYXRpb24vMjMvMDQvMzIwMjQ2NzUvaWYteW91LWludmVzdGVkLTEtMDAwLWluLWdvb2dsZS1zdG9jay13aGVuLWl0LWFjcXVpcmVkLXlvdXR1YmUtaGVyZXMtaG93LW11Y2gteW91ZC1oYXZlLXRvZGF50gEtaHR0cHM6Ly93d3cuYmVuemluZ2EuY29tL2FtcC9jb250ZW50LzMyMDI0Njc1?oc=5,2023-04-26,invested 1 000 google stock acquired youtube much today alpha benzinga,0.2,2023-04-26,105.55999755859376,107.0199966430664,103.2699966430664,104.4499969482422,104.3312759399414,37068200
"Pixel Fold is coming next week, Google shares first look - India Today",https://news.google.com/rss/articles/CBMiemh0dHBzOi8vd3d3LmluZGlhdG9kYXkuaW4vdGVjaG5vbG9neS9uZXdzL3N0b3J5L3BpeGVsLWZvbGQtaXMtY29taW5nLW5leHQtd2Vlay1nb29nbGUtc2hhcmVzLWZpcnN0LWxvb2stMjM2ODc2OS0yMDIzLTA1LTA10gF-aHR0cHM6Ly93d3cuaW5kaWF0b2RheS5pbi9hbXAvdGVjaG5vbG9neS9uZXdzL3N0b3J5L3BpeGVsLWZvbGQtaXMtY29taW5nLW5leHQtd2Vlay1nb29nbGUtc2hhcmVzLWZpcnN0LWxvb2stMjM2ODc2OS0yMDIzLTA1LTA1?oc=5,2023-05-05,pixel fold coming next week google shares first look india today,0.125,2023-05-05,105.31999969482422,106.44000244140624,104.73899841308594,106.21499633789062,106.09426879882812,20705300
"Google parent announces stock buyback, modest beat on ad sales - Reuters",https://news.google.com/rss/articles/CBMiYWh0dHBzOi8vd3d3LnJldXRlcnMuY29tL3RlY2hub2xvZ3kvZ29vZ2xlLXBhcmVudC1hbHBoYWJldHMtcmV2ZW51ZS1iZWF0cy1leHBlY3RhdGlvbnMtMjAyMy0wNC0yNS_SAQA?oc=5,2023-04-25,google parent announces stock buyback modest beat ad sales reuters,0.1,2023-04-25,106.61000061035156,107.44000244140624,104.55999755859376,104.61000061035156,104.49109649658205,31408100
Alphabet authorizes $70 billion buyback - CNBC,https://news.google.com/rss/articles/CBMiSWh0dHBzOi8vd3d3LmNuYmMuY29tLzIwMjMvMDQvMjUvZ29vZ2xlLWF1dGhvcml6ZXMtNzAtYmlsbGlvbi1idXliYWNrLmh0bWzSAU1odHRwczovL3d3dy5jbmJjLmNvbS9hbXAvMjAyMy8wNC8yNS9nb29nbGUtYXV0aG9yaXplcy03MC1iaWxsaW9uLWJ1eWJhY2suaHRtbA?oc=5,2023-04-25,alphabet authorizes 70 billion buyback cnbc,0.0,2023-04-25,106.61000061035156,107.44000244140624,104.55999755859376,104.61000061035156,104.49109649658205,31408100
"Stock Markets Today: First Republic, Microsoft Google AI, Elon Musk Tesla - Bloomberg",https://news.google.com/rss/articles/CBMifGh0dHBzOi8vd3d3LmJsb29tYmVyZy5jb20vbmV3cy9uZXdzbGV0dGVycy8yMDIzLTA0LTI2L3N0b2NrLW1hcmtldHMtdG9kYXktZmlyc3QtcmVwdWJsaWMtbWljcm9zb2Z0LWdvb2dsZS1haS1lbG9uLW11c2stdGVzbGHSAQA?oc=5,2023-04-25,stock markets today first republic microsoft google ai elon musk tesla bloomberg,0.25,2023-04-25,106.61000061035156,107.44000244140624,104.55999755859376,104.61000061035156,104.49109649658205,31408100
Alphabet earnings: First quarter results top estimates - Yahoo Finance,https://news.google.com/rss/articles/CBMid2h0dHBzOi8vZmluYW5jZS55YWhvby5jb20vbmV3cy9hbHBoYWJldC1maXJzdC1xdWFydGVyLWVhcm5pbmdzLXRvcC1lc3RpbWF0ZXMtYW5ub3VuY2VzLTcwYi1zdG9jay1idXliYWNrLTIwMDkwNDc1NS5odG1s0gEA?oc=5,2023-04-25,alphabet earnings first quarter results top estimates yahoo finance,0.375,2023-04-25,106.61000061035156,107.44000244140624,104.55999755859376,104.61000061035156,104.49109649658205,31408100
Alphabet reports revenue and earnings beat for first quarter - CNBC,https://news.google.com/rss/articles/CBMiS2h0dHBzOi8vd3d3LmNuYmMuY29tLzIwMjMvMDQvMjUvYWxwaGFiZXQtZ29vZ2wtcTEtZWFybmluZ3MtcmVwb3J0LTIwMjMuaHRtbNIBT2h0dHBzOi8vd3d3LmNuYmMuY29tL2FtcC8yMDIzLzA0LzI1L2FscGhhYmV0LWdvb2dsLXExLWVhcm5pbmdzLXJlcG9ydC0yMDIzLmh0bWw?oc=5,2023-04-25,alphabet reports revenue earnings beat first quarter cnbc,0.25,2023-04-25,106.61000061035156,107.44000244140624,104.55999755859376,104.61000061035156,104.49109649658205,31408100
"Google Earnings Top Estimates on Search Ads, Alphabet (GOOG) Stock Rises - Bloomberg",https://news.google.com/rss/articles/CBMia2h0dHBzOi8vd3d3LmJsb29tYmVyZy5jb20vbmV3cy9hcnRpY2xlcy8yMDIzLTA0LTI1L2FscGhhYmV0LXNoYXJlcy1yaXNlLW9uLXJldmVudWUtYmVhdC1hcy1hZC1zYWxlcy1yZWNvdmVy0gEA?oc=5,2023-04-25,google earnings top estimates search ads alphabet goog stock rises bloomberg,0.5,2023-04-25,106.61000061035156,107.44000244140624,104.55999755859376,104.61000061035156,104.49109649658205,31408100
Live Updates: Microsoft and Google shares pop after earnings results - CNN,https://news.google.com/rss/articles/CBMiO2h0dHBzOi8vd3d3LmNubi5jb20vdGVjaC9saXZlLW5ld3MvdGVjaC1lYXJuaW5ncy9pbmRleC5odG1s0gE0aHR0cHM6Ly9hbXAuY25uLmNvbS9jbm4vdGVjaC9saXZlLW5ld3MvdGVjaC1lYXJuaW5ncw?oc=5,2023-04-25,live updates microsoft google shares pop earnings results cnn,0.13636363636363635,2023-04-25,106.61000061035156,107.44000244140624,104.55999755859376,104.61000061035156,104.49109649658205,31408100
$70 Billion Google Buyback! Alphabet Stock Earnings Recap - The Motley Fool,https://news.google.com/rss/articles/CBMiXGh0dHBzOi8vd3d3LmZvb2wuY29tL2ludmVzdGluZy8yMDIzLzA0LzI1LzcwLWJpbGxpb24tZ29vZ2xlLWJ1eWJhY2stYWxwaGFiZXQtc3RvY2stZWFybmluZ3Mv0gEA?oc=5,2023-04-25,70 billion google buyback alphabet stock earnings recap motley fool,0.6,2023-04-25,106.61000061035156,107.44000244140624,104.55999755859376,104.61000061035156,104.49109649658205,31408100
Google’s Sergey Brin Dumped $366M Tesla Stock Over Beef With Elon Musk - Observer,https://news.google.com/rss/articles/CBMiRWh0dHBzOi8vb2JzZXJ2ZXIuY29tLzIwMjMvMDQvZ29vZ2xlLXNlcmdleS1icmluLXNlbGwtdGVzbGEtbm9ucHJvZml0L9IBAA?oc=5,2023-04-25,google sergey brin dumped 366m tesla stock beef elon musk observer,0.0,2023-04-25,106.61000061035156,107.44000244140624,104.55999755859376,104.61000061035156,104.49109649658205,31408100
Google (GOOGL) announces plan for additional $70 billion share buyback - Shacknews,https://news.google.com/rss/articles/CBMiU2h0dHBzOi8vd3d3LnNoYWNrbmV3cy5jb20vYXJ0aWNsZS8xMzUyMzQvZ29vZ2xlLTcwLWJpbGxpb24tYWRkaXRpb25hbC1zdG9jay1idXliYWNr0gFdaHR0cHM6Ly93d3cuc2hhY2tuZXdzLmNvbS9hcnRpY2xlLzEzNTIzNC9nb29nbGUtNzAtYmlsbGlvbi1hZGRpdGlvbmFsLXN0b2NrLWJ1eWJhY2s_YW1waHRtbD0x?oc=5,2023-04-25,google googl announces plan additional 70 billion share buyback shacknews,0.0,2023-04-25,106.61000061035156,107.44000244140624,104.55999755859376,104.61000061035156,104.49109649658205,31408100
"Google's Larry Page, Sergey Brin Net Worth Rises on AI Stock Boost (GOOGL) - Bloomberg",https://news.google.com/rss/articles/CBMibWh0dHBzOi8vd3d3LmJsb29tYmVyZy5jb20vbmV3cy9hcnRpY2xlcy8yMDIzLTA1LTEyL2dvb2dsZS1jby1mb3VuZGVycy1nYWluLTE3LWJpbGxpb24tYXMtYWktYm9vc3QtbGlmdHMtc3RvY2vSAQA?oc=5,2023-05-12,google larry page sergey brin net worth rises ai stock boost googl bloomberg,0.15,2023-05-12,117.0,118.26000213623048,116.5500030517578,117.91999816894533,117.78596496582033,31272500
Dow Jones Futures Rise Amid Divided Market Rally; Tesla Pops On Elon Musk's Twitter News - Investor's Business Daily,https://news.google.com/rss/articles/CBMikgFodHRwczovL3d3dy5pbnZlc3RvcnMuY29tL21hcmtldC10cmVuZC9zdG9jay1tYXJrZXQtdG9kYXkvZG93LWpvbmVzLWZ1dHVyZXMtbWFya2V0LXJhbGx5LXdlYWstb3V0c2lkZS1nb29nbGUtdGVzbGEtcG9wcy1vbi1lbG9uLW11c2stdHdpdHRlci1uZXdzL9IBAA?oc=5,2023-05-12,dow jones futures rise amid divided market rally tesla pops elon musk twitter news investor business daily,0.0,2023-05-12,117.0,118.26000213623048,116.5500030517578,117.91999816894533,117.78596496582033,31272500
Google employees complain about CEO Sundar Pichai's pay raise as cost cuts hit rest of the company - CNBC,https://news.google.com/rss/articles/CBMiYWh0dHBzOi8vd3d3LmNuYmMuY29tLzIwMjMvMDUvMDMvZ29vZ2xlLWVtcGxveWVlcy1jb21wbGFpbi1hYm91dC1jZW8tc3VuZGFyLXBpY2hhaXMtcGF5LXJhaXNlLmh0bWzSAWVodHRwczovL3d3dy5jbmJjLmNvbS9hbXAvMjAyMy8wNS8wMy9nb29nbGUtZW1wbG95ZWVzLWNvbXBsYWluLWFib3V0LWNlby1zdW5kYXItcGljaGFpcy1wYXktcmFpc2UuaHRtbA?oc=5,2023-05-03,google employees complain ceo sundar pichai pay raise cost cuts hit rest company cnbc,0.0,2023-05-03,106.22000122070312,108.12999725341795,105.62000274658205,106.12000274658205,105.99938201904295,17116300
Warren Buffett Just Accidentally Described Why Google Is the Best TV Streaming Stock - The Motley Fool,https://news.google.com/rss/articles/CBMiXWh0dHBzOi8vd3d3LmZvb2wuY29tL2ludmVzdGluZy8yMDIzLzA1LzE2L3dhcnJlbi1idWZmZXR0LWp1c3QtYWNjaWRlbnRhbGx5LWRlc2NyaWJlZC13aHktZ29vL9IBAA?oc=5,2023-05-16,warren buffett accidentally described google best tv streaming stock motley fool,0.8,2023-05-16,116.83000183105467,121.1999969482422,116.83000183105467,120.08999633789062,119.9534912109375,32370100
"Google software engineer shares 5 tips that helped her get job interview calls from Microsoft, Amazon, Infosys - India Today",https://news.google.com/rss/articles/CBMirwFodHRwczovL3d3dy5pbmRpYXRvZGF5LmluL3RlY2hub2xvZ3kvbmV3cy9zdG9yeS9nb29nbGUtc29mdHdhcmUtZW5naW5lZXItc2hhcmVzLTUtdGlwcy10aGF0LWhlbHBlZC1oZXItZ2V0LWpvYi1pbnRlcnZpZXctY2FsbHMtZnJvbS1taWNyb3NvZnQtYW1hem9uLWluZm9zeXMtMjM4MDA1MC0yMDIzLTA1LTE20gGzAWh0dHBzOi8vd3d3LmluZGlhdG9kYXkuaW4vYW1wL3RlY2hub2xvZ3kvbmV3cy9zdG9yeS9nb29nbGUtc29mdHdhcmUtZW5naW5lZXItc2hhcmVzLTUtdGlwcy10aGF0LWhlbHBlZC1oZXItZ2V0LWpvYi1pbnRlcnZpZXctY2FsbHMtZnJvbS1taWNyb3NvZnQtYW1hem9uLWluZm9zeXMtMjM4MDA1MC0yMDIzLTA1LTE2?oc=5,2023-05-16,google software engineer shares 5 tips helped get job interview calls microsoft amazon infosys india today,0.0,2023-05-16,116.83000183105467,121.1999969482422,116.83000183105467,120.08999633789062,119.9534912109375,32370100
