title,link,pub_date,cleaned_text,sentiment,Date,Open,High,Low,Close,Adj Close,Volume
Google Parent Alphabet Names Goldman Sachs Veteran to Board - Bloomberg,https://news.google.com/rss/articles/CBMibmh0dHBzOi8vd3d3LmJsb29tYmVyZy5jb20vbmV3cy9hcnRpY2xlcy8yMDIyLTA3LTE0L2dvb2dsZS1wYXJlbnQtYWxwaGFiZXQtbmFtZXMtZ29sZG1hbi1zYWNocy12ZXRlcmFuLXRvLWJvYXJk0gEA?oc=5,2022-07-14,google parent alphabet names goldman sachs veteran board bloomberg,0.0,2022-07-14,110.82599639892578,111.9875030517578,109.32550048828124,111.44000244140624,111.3133316040039,32366000
How to Buy Google Stock After the Split: GOOG vs. GOOGL - Market Realist,https://news.google.com/rss/articles/CBMiS2h0dHBzOi8vbWFya2V0cmVhbGlzdC5jb20vc3RvY2tzLWFuZC1tYXJrZXRzL2hvdy10by1idXktZ29vZ2xlLXN0b2NrLXNwbGl0L9IBAA?oc=5,2022-07-14,buy google stock split goog vs googl market realist,0.0,2022-07-14,110.82599639892578,111.9875030517578,109.32550048828124,111.44000244140624,111.3133316040039,32366000
How to Make Your Android Phone Look Like a Google Pixel Without Rooting - Make Tech Easier,https://news.google.com/rss/articles/CBMiQ2h0dHBzOi8vd3d3Lm1ha2V0ZWNoZWFzaWVyLmNvbS90dXJuLWFuZHJvaWQtZGV2aWNlLXRvLWdvb2dsZS1waXhlbC_SAQA?oc=5,2022-07-14,make android phone look like google pixel without rooting make tech easier,0.0,2022-07-14,110.82599639892578,111.9875030517578,109.32550048828124,111.44000244140624,111.3133316040039,32366000
Alphabet Stock Split Lands With a Thud in Worry-Filled Market - Bloomberg,https://news.google.com/rss/articles/CBMicGh0dHBzOi8vd3d3LmJsb29tYmVyZy5jb20vbmV3cy9hcnRpY2xlcy8yMDIyLTA3LTIyL2FscGhhYmV0LXN0b2NrLXNwbGl0LWxhbmRzLXdpdGgtYS10aHVkLWluLXdvcnJ5LWZpbGxlZC1tYXJrZXTSAQA?oc=5,2022-07-22,alphabet stock split lands thud worry filled market bloomberg,0.4,2022-07-22,111.80999755859376,113.18000030517578,107.5999984741211,108.36000061035156,108.23683166503906,44455300
Why Did Google Invest In Bharti Airtel? - NDTV Profit,https://news.google.com/rss/articles/CBMiUmh0dHBzOi8vd3d3Lm5kdHZwcm9maXQuY29tL2J1c2luZXNzL3doeS1kaWQtZ29vZ2xlLWludmVzdC1pbi1iaGFydGktYWlydGVsLTMxODI5NDPSAVZodHRwczovL3d3dy5uZHR2cHJvZml0LmNvbS9hbXAvYnVzaW5lc3Mvd2h5LWRpZC1nb29nbGUtaW52ZXN0LWluLWJoYXJ0aS1haXJ0ZWwtMzE4Mjk0Mw?oc=5,2022-07-22,google invest bharti airtel ndtv profit,0.0,2022-07-22,111.80999755859376,113.18000030517578,107.5999984741211,108.36000061035156,108.23683166503906,44455300
Google shares highlights from the 2022 ESSENCE Festival - The Keyword | Google Product and Technology News,https://news.google.com/rss/articles/CBMiY2h0dHBzOi8vYmxvZy5nb29nbGUvb3V0cmVhY2gtaW5pdGlhdGl2ZXMvZGl2ZXJzaXR5LzQtZGF5cy13aXRoLWdvb2dsZS1hdC10aGUtMjAyMi1lc3NlbmNlLWZlc3RpdmFsL9IBAA?oc=5,2022-07-22,google shares highlights 2022 essence festival keyword google product technology news,0.0,2022-07-22,111.80999755859376,113.18000030517578,107.5999984741211,108.36000061035156,108.23683166503906,44455300
This Eye-Opening Ratio Shows Why Alphabet Stock Is a Buy Now - The Motley Fool,https://news.google.com/rss/articles/CBMiXWh0dHBzOi8vd3d3LmZvb2wuY29tL2ludmVzdGluZy8yMDIyLzA3LzIyL3RoaXMtZXllLW9wZW5pbmctcmF0aW8tc2hvd3Mtd2h5LWFscGhhYmV0LXN0b2NrLWlzL9IBAA?oc=5,2022-07-22,eye opening ratio shows alphabet stock buy motley fool,0.6,2022-07-22,111.80999755859376,113.18000030517578,107.5999984741211,108.36000061035156,108.23683166503906,44455300
Google's stock just got a lot cheaper - CNN,https://news.google.com/rss/articles/CBMiT2h0dHBzOi8vd3d3LmNubi5jb20vMjAyMi8wNy8xOC9pbnZlc3RpbmcvZ29vZ2xlLWFscGhhYmV0LXN0b2NrLXNwbGl0L2luZGV4Lmh0bWzSAUhodHRwczovL2FtcC5jbm4uY29tL2Nubi8yMDIyLzA3LzE4L2ludmVzdGluZy9nb29nbGUtYWxwaGFiZXQtc3RvY2stc3BsaXQ?oc=5,2022-07-18,google stock got lot cheaper cnn,0.0,2022-07-18,113.44000244140624,114.8000030517578,109.3000030517578,109.91000366210938,109.78507232666016,33354000
Stock Splits in 2022: Should You Buy Google or Amazon Stock? - Money,https://news.google.com/rss/articles/CBMiOWh0dHBzOi8vbW9uZXkuY29tL2JpZ2dlc3Qtc3RvY2stc3BsaXRzLTIwMjItZ29vZ2xlLXRlc2xhL9IBAA?oc=5,2022-07-18,stock splits 2022 buy google amazon stock money,0.0,2022-07-18,113.44000244140624,114.8000030517578,109.3000030517578,109.91000366210938,109.78507232666016,33354000
ESG performance and stock prices: evidence from the COVID-19 outbreak in China | Humanities and Social Sciences ... - Nature.com,https://news.google.com/rss/articles/CBMiMmh0dHBzOi8vd3d3Lm5hdHVyZS5jb20vYXJ0aWNsZXMvczQxNTk5LTAyMi0wMTI1OS010gEA?oc=5,2022-07-18,esg performance stock prices evidence covid 19 outbreak china humanities social sciences nature com,0.03333333333333333,2022-07-18,113.44000244140624,114.8000030517578,109.3000030517578,109.91000366210938,109.78507232666016,33354000
Alphabet (GOOG) stock debuts after 20-for-1 split at $112 - FXStreet,https://news.google.com/rss/articles/CBMiY2h0dHBzOi8vd3d3LmZ4c3RyZWV0LmNvbS9uZXdzL2hvdy10by1wbGF5LWdvb2dsZS1wYXJlbnQtYWxwaGFiZXRzLTIwLWZvci0xLXN0b2NrLXNwbGl0LTIwMjIwNzEyMTUzNNIBZ2h0dHBzOi8vd3d3LmZ4c3RyZWV0LmNvbS9hbXAvbmV3cy9ob3ctdG8tcGxheS1nb29nbGUtcGFyZW50LWFscGhhYmV0cy0yMC1mb3ItMS1zdG9jay1zcGxpdC0yMDIyMDcxMjE1MzQ?oc=5,2022-07-18,alphabet goog stock debuts 20 1 split 112 fxstreet,0.0,2022-07-18,113.44000244140624,114.8000030517578,109.3000030517578,109.91000366210938,109.78507232666016,33354000
Google Doodle Shares Artwork by 10-Year-Old Uvalde Shooting Victim - Hyperallergic,https://news.google.com/rss/articles/CBMiWGh0dHBzOi8vaHlwZXJhbGxlcmdpYy5jb20vNzQ4NTAyL2dvb2dsZS1kb29kbGUtc2hhcmVzLWFydHdvcmstYnktdXZhbGRlLXNob290aW5nLXZpY3RpbS_SAQA?oc=5,2022-07-18,google doodle shares artwork 10 year old uvalde shooting victim hyperallergic,0.012499999999999997,2022-07-18,113.44000244140624,114.8000030517578,109.3000030517578,109.91000366210938,109.78507232666016,33354000
Alphabet's Stock Split Has Taken Effect. Now What? - The Motley Fool,https://news.google.com/rss/articles/CBMiWmh0dHBzOi8vd3d3LmZvb2wuY29tL2ludmVzdGluZy8yMDIyLzA3LzE4L2FscGhhYmV0cy1zdG9jay1zcGxpdC1oYXMtdGFrZW4tZWZmZWN0LW5vdy13aGF0L9IBAA?oc=5,2022-07-18,alphabet stock split taken effect motley fool,0.6,2022-07-18,113.44000244140624,114.8000030517578,109.3000030517578,109.91000366210938,109.78507232666016,33354000
Blackstone to Finance $1.2B Luxury Towers on NYC Waterfront - Globe St.,https://news.google.com/rss/articles/CBMiXmh0dHBzOi8vd3d3Lmdsb2Jlc3QuY29tLzIwMjIvMDcvMTgvYmxhY2tzdG9uZS10by1maW5hbmNlLTEtMmItbHV4dXJ5LXRvd2Vycy1vbi1ueWMtd2F0ZXJmcm9udC_SAWRodHRwczovL3d3dy5nbG9iZXN0LmNvbS8yMDIyLzA3LzE4L2JsYWNrc3RvbmUtdG8tZmluYW5jZS0xLTJiLWx1eHVyeS10b3dlcnMtb24tbnljLXdhdGVyZnJvbnQvP2FtcD0x?oc=5,2022-07-18,blackstone finance 1 2b luxury towers nyc waterfront globe st,0.0,2022-07-18,113.44000244140624,114.8000030517578,109.3000030517578,109.91000366210938,109.78507232666016,33354000
GameStop to split its stock in 4:1 ratio on July 18 - INDmoney,https://news.google.com/rss/articles/CBMiQGh0dHBzOi8vd3d3LmluZG1vbmV5LmNvbS9hcnRpY2xlcy91cy1zdG9ja3MvZ2FtZXN0b3Atc3RvY2stc3BsaXTSAQA?oc=5,2022-07-08,gamestop split stock 4 1 ratio july 18 indmoney,0.0,2022-07-08,117.5500030517578,120.43499755859376,117.51399993896484,120.1685028076172,120.03191375732422,29082000
Google takes 1.3 million sq ft of office space in Bengaluru on lease: sources - IndiaTimes,https://news.google.com/rss/articles/CBMipAFodHRwczovL20uZWNvbm9taWN0aW1lcy5jb20vaW5kdXN0cnkvc2VydmljZXMvcHJvcGVydHktLy1jc3RydWN0aW9uL2dvb2dsZS10YWtlcy0xLTMtbW4tc3EtZnQtb2Ytb2ZmaWNlLXNwYWNlLWluLWJlbmdhbHVydS1vbi1sZWFzZS1zb3VyY2VzL2FydGljbGVzaG93LzkyODM1ODUyLmNtc9IBAA?oc=5,2022-07-12,google takes 1 3 million sq ft office space bengaluru lease sources indiatimes,0.0,2022-07-12,116.8385009765625,117.84950256347656,114.61499786376952,114.84950256347656,114.71895599365234,24970000
"This Bluechip Mutual Fund Has Holdings In Facebook, Google & Amazon, Outperformed Benchmark - Goodreturns",https://news.google.com/rss/articles/CBMimwFodHRwczovL3d3dy5nb29kcmV0dXJucy5pbi9wZXJzb25hbC1maW5hbmNlL2ludmVzdG1lbnQvdGhpcy1ibHVlY2hpcC1tdXR1YWwtZnVuZC1oYXMtaG9sZGluZ3MtaW4tZmFjZWJvb2stZ29vZ2xlLWFtYXpvbi1vdXRwZXJmb3JtZWQtYmVuY2htYXJrLTEyNTUyNzQuaHRtbNIBAA?oc=5,2022-07-12,bluechip mutual fund holdings facebook google amazon outperformed benchmark goodreturns,0.0,2022-07-12,116.8385009765625,117.84950256347656,114.61499786376952,114.84950256347656,114.71895599365234,24970000
Google CEO Pichai says company will slow hiring through 2023 in memo to employees - CNBC,https://news.google.com/rss/articles/CBMiZmh0dHBzOi8vd3d3LmNuYmMuY29tLzIwMjIvMDcvMTIvZ29vZ2xlLXNheXMtaXQtd2lsbC1zbG93LWhpcmluZy10aHJvdWdoLTIwMjMtaW4tbWVtby10by1lbXBsb3llZXMuaHRtbNIBamh0dHBzOi8vd3d3LmNuYmMuY29tL2FtcC8yMDIyLzA3LzEyL2dvb2dsZS1zYXlzLWl0LXdpbGwtc2xvdy1oaXJpbmctdGhyb3VnaC0yMDIzLWluLW1lbW8tdG8tZW1wbG95ZWVzLmh0bWw?oc=5,2022-07-12,google ceo pichai says company slow hiring 2023 memo employees cnbc,-0.30000000000000004,2022-07-12,116.8385009765625,117.84950256347656,114.61499786376952,114.84950256347656,114.71895599365234,24970000
"Walmart Cloud Weans Itself Off of Microsoft Azure, Google Cloud - Bloomberg",https://news.google.com/rss/articles/CBMidGh0dHBzOi8vd3d3LmJsb29tYmVyZy5jb20vbmV3cy9uZXdzbGV0dGVycy8yMDIyLTA3LTEyL3dhbG1hcnQtY2xvdWQtd2VhbnMtaXRzZWxmLW9mZi1vZi1taWNyb3NvZnQtYXp1cmUtZ29vZ2xlLWNsb3Vk0gEA?oc=5,2022-07-12,walmart cloud weans microsoft azure google cloud bloomberg,0.0,2022-07-12,116.8385009765625,117.84950256347656,114.61499786376952,114.84950256347656,114.71895599365234,24970000
IBD 50 Stocks To Watch: Pest Control Leader Hits Buy Point - Investor's Business Daily,https://news.google.com/rss/articles/CBMiggFodHRwczovL3d3dy5pbnZlc3RvcnMuY29tL3Jlc2VhcmNoL2liZC01MC1zdG9ja3MtdG8td2F0Y2gtcGVzdC1jb250cm9sLWxlYWRlci1yb2xsaW5zLWhpdHMtbmV3LWJ1eS1wb2ludC13aXRoLXJzLWxpbmUtYXQtbmV3LWhpZ2gv0gEA?oc=5,2022-07-12,ibd 50 stocks watch pest control leader hits buy point investor business daily,0.0,2022-07-12,116.8385009765625,117.84950256347656,114.61499786376952,114.84950256347656,114.71895599365234,24970000
Google (Alphabet) Earnings: What to Look For - Investopedia,https://news.google.com/rss/articles/CBMiVmh0dHBzOi8vd3d3LmludmVzdG9wZWRpYS5jb20vYWxwaGFiZXQtZ29vZ2xlLXEyLWZ5MjAyMi1lYXJuaW5ncy1yZXBvcnQtcHJldmlldy02MjYwNDM00gEA?oc=5,2022-07-25,google alphabet earnings look investopedia,0.0,2022-07-25,108.87999725341795,110.58000183105467,107.01000213623048,108.20999908447266,108.08699798583984,28289900
"Nicole Shanahan: Google co-founder's attorney wife, in news for alleged affair with Elon Musk - Moneycontrol",https://news.google.com/rss/articles/CBMiswFodHRwczovL3d3dy5tb25leWNvbnRyb2wuY29tL25ld3MvdHJlbmRzL2N1cnJlbnQtYWZmYWlycy10cmVuZHMvbmljb2xlLXNoYW5haGFuLWdvb2dsZS1jby1mb3VuZGVyLXNlcmdleS1icmlucy1hdHRvcm5leS13aWZlLWluLW5ld3MtZm9yLWFsbGVnZWQtYWZmYWlyLXdpdGgtZWxvbi1tdXNrLTg4ODI2NjEuaHRtbNIBtwFodHRwczovL3d3dy5tb25leWNvbnRyb2wuY29tL25ld3MvdHJlbmRzL2N1cnJlbnQtYWZmYWlycy10cmVuZHMvbmljb2xlLXNoYW5haGFuLWdvb2dsZS1jby1mb3VuZGVyLXNlcmdleS1icmlucy1hdHRvcm5leS13aWZlLWluLW5ld3MtZm9yLWFsbGVnZWQtYWZmYWlyLXdpdGgtZWxvbi1tdXNrLTg4ODI2NjEuaHRtbC9hbXA?oc=5,2022-07-25,nicole shanahan google co founder attorney wife news alleged affair elon musk moneycontrol,-0.1,2022-07-25,108.87999725341795,110.58000183105467,107.01000213623048,108.20999908447266,108.08699798583984,28289900
Sergey Brin Might Score $100 Million Profit by Selling Tesla Stock - Markets Insider,https://news.google.com/rss/articles/CBMid2h0dHBzOi8vbWFya2V0cy5idXNpbmVzc2luc2lkZXIuY29tL25ld3Mvc3RvY2tzL3NlcmdleS1icmluLWdvb2dsZS1lbG9uLW11c2stdGVzbGEtc3RvY2stZWxlY3RyaWMtdmVoaWNsZXMtc3Rha2UtMjAyMi030gEA?oc=5,2022-07-25,sergey brin might score 100 million profit selling tesla stock markets insider,0.0,2022-07-25,108.87999725341795,110.58000183105467,107.01000213623048,108.20999908447266,108.08699798583984,28289900
Sergey Brin Might Score $100 Million Profit by Selling Tesla Stock - Markets Insider,https://news.google.com/rss/articles/CBMid2h0dHBzOi8vbWFya2V0cy5idXNpbmVzc2luc2lkZXIuY29tL25ld3Mvc3RvY2tzL3NlcmdleS1icmluLWdvb2dsZS1lbG9uLW11c2stdGVzbGEtc3RvY2stZWxlY3RyaWMtdmVoaWNsZXMtc3Rha2UtMjAyMi030gEA?oc=5,2022-07-25,sergey brin might score 100 million profit selling tesla stock markets insider,0.0,2022-07-25,108.87999725341795,110.58000183105467,107.01000213623048,108.20999908447266,108.08699798583984,28289900
How fintechs are responding to their falling valuations - American Banker,https://news.google.com/rss/articles/CBMiZGh0dHBzOi8vd3d3LmFtZXJpY2FuYmFua2VyLmNvbS9wYXltZW50cy9saXN0L2hvdy1maW50ZWNocy1hcmUtcmVzcG9uZGluZy10by10aGVpci1mYWxsaW5nLXZhbHVhdGlvbnPSAQA?oc=5,2022-07-25,fintechs responding falling valuations american banker,0.0,2022-07-25,108.87999725341795,110.58000183105467,107.01000213623048,108.20999908447266,108.08699798583984,28289900
These four free personal finance courses can set you up for financial success in three hours or less - CNBC,https://news.google.com/rss/articles/CBMiOmh0dHBzOi8vd3d3LmNuYmMuY29tL3NlbGVjdC9mcmVlLXBlcnNvbmFsLWZpbmFuY2UtY291cnNlcy_SAT5odHRwczovL3d3dy5jbmJjLmNvbS9hbXAvc2VsZWN0L2ZyZWUtcGVyc29uYWwtZmluYW5jZS1jb3Vyc2VzLw?oc=5,2022-07-20,four free personal finance courses set financial success three hours less cnbc,0.10666666666666666,2022-07-20,114.05999755859376,116.33000183105467,113.26000213623048,114.6999969482422,114.56961822509766,26780100
Google Timer: Popular stopwatch feature goes missing on Google Search - Deccan Herald,https://news.google.com/rss/articles/CBMieWh0dHBzOi8vd3d3LmRlY2NhbmhlcmFsZC5jb20vdGVjaG5vbG9neS9nb29nbGUtdGltZXItcG9wdWxhci1zdG9wd2F0Y2gtZmVhdHVyZS1nb2VzLW1pc3Npbmctb24tZ29vZ2xlLXNlYXJjaC0xMTI4NTEyLmh0bWzSAQA?oc=5,2022-07-20,google timer popular stopwatch feature goes missing google search deccan herald,0.19999999999999998,2022-07-20,114.05999755859376,116.33000183105467,113.26000213623048,114.6999969482422,114.56961822509766,26780100
7 Best Stocks for College Graduates - Yahoo Finance,https://news.google.com/rss/articles/CBMiTWh0dHBzOi8vZmluYW5jZS55YWhvby5jb20vbmV3cy83LWJlc3Qtc3RvY2tzLWNvbGxlZ2UtZ3JhZHVhdGVzLTEwMzAzNzgwMy5odG1s0gEA?oc=5,2022-07-20,7 best stocks college graduates yahoo finance,1.0,2022-07-20,114.05999755859376,116.33000183105467,113.26000213623048,114.6999969482422,114.56961822509766,26780100
‘The best travel hack’: TikTok user shares secret Google Translate function - The Independent,https://news.google.com/rss/articles/CBMiaGh0dHBzOi8vd3d3LmluZGVwZW5kZW50LmNvLnVrL3RyYXZlbC9uZXdzLWFuZC1hZHZpY2UvdGlrdG9rLWdvb2dsZS10cmFuc2xhdGUtYXBwLW1lbnUtaGFjay1iMjEyNzYyNi5odG1s0gEA?oc=5,2022-07-20,best travel hack tiktok user shares secret google translate function independent,0.19999999999999998,2022-07-20,114.05999755859376,116.33000183105467,113.26000213623048,114.6999969482422,114.56961822509766,26780100
"Kolkata student rejects Google, Amazon for plum Facebook job. His salary is… - Moneycontrol",https://news.google.com/rss/articles/CBMimgFodHRwczovL3d3dy5tb25leWNvbnRyb2wuY29tL25ld3MvdHJlbmRzL3RoaXMtc3R1ZGVudC1iYWdnZWQtYS1ycy0xLTgtY3JvcmUtam9iLXdpdGgtZmFjZWJvb2staW4tdWstYWZ0ZXItcmVqZWN0aW5nLW9mZmVycy1mcm9tLWdvb2dsZS1hbWF6b24tODc0MzczMS5odG1s0gGeAWh0dHBzOi8vd3d3Lm1vbmV5Y29udHJvbC5jb20vbmV3cy90cmVuZHMvdGhpcy1zdHVkZW50LWJhZ2dlZC1hLXJzLTEtOC1jcm9yZS1qb2Itd2l0aC1mYWNlYm9vay1pbi11ay1hZnRlci1yZWplY3Rpbmctb2ZmZXJzLWZyb20tZ29vZ2xlLWFtYXpvbi04NzQzNzMxLmh0bWwvYW1w?oc=5,2022-06-27,kolkata student rejects google amazon plum facebook job salary moneycontrol,0.0,2022-06-27,118.93499755859376,119.25,116.00074768066406,116.62249755859376,116.48993682861328,32840000
Stock Market Indicators Investors Need To Know – Forbes Advisor UK - Forbes,https://news.google.com/rss/articles/CBMiW2h0dHBzOi8vd3d3LmZvcmJlcy5jb20vdWsvYWR2aXNvci9pbnZlc3Rpbmcvc3RvY2stbWFya2V0LWluZGljYXRvcnMtaW52ZXN0b3JzLW5lZWQtdG8ta25vdy_SAQA?oc=5,2022-06-28,stock market indicators investors need know forbes advisor uk forbes,0.0,2022-06-28,116.35099792480467,117.85649871826172,112.44400024414062,112.57150268554688,112.44355010986328,28232000
"Pinterest CEO steps down, Google executive to take over in e-commerce push - CNN",https://news.google.com/rss/articles/CBMiPGh0dHBzOi8vd3d3LmNubi5jb20vMjAyMi8wNi8yOC90ZWNoL3BpbnRlcmVzdC1jZW8vaW5kZXguaHRtbNIBNWh0dHBzOi8vYW1wLmNubi5jb20vY25uLzIwMjIvMDYvMjgvdGVjaC9waW50ZXJlc3QtY2Vv?oc=5,2022-06-28,pinterest ceo steps google executive take e commerce push cnn,0.0,2022-06-28,116.35099792480467,117.85649871826172,112.44400024414062,112.57150268554688,112.44355010986328,28232000
Swiftcover Car Insurance Review – Forbes Advisor UK - Forbes,https://news.google.com/rss/articles/CBMiQmh0dHBzOi8vd3d3LmZvcmJlcy5jb20vdWsvYWR2aXNvci9jYXItaW5zdXJhbmNlL3Jldmlldy1zd2lmdGNvdmVyL9IBAA?oc=5,2022-06-28,swiftcover car insurance review forbes advisor uk forbes,0.0,2022-06-28,116.35099792480467,117.85649871826172,112.44400024414062,112.57150268554688,112.44355010986328,28232000
Amouranth makes “no-brainer” $1 million investment in Twitch owner Amazon - Dexerto,https://news.google.com/rss/articles/CBMidWh0dHBzOi8vd3d3LmRleGVydG8uY29tL2VudGVydGFpbm1lbnQvYW1vdXJhbnRoLW1ha2VzLW5vLWJyYWluZXItMS1taWxsaW9uLWludmVzdG1lbnQtaW4tdHdpdGNoLW93bmVyLWFtYXpvbi0xODIxNDY1L9IBAA?oc=5,2022-06-28,amouranth makes brainer 1 million investment twitch owner amazon dexerto,0.0,2022-06-28,116.35099792480467,117.85649871826172,112.44400024414062,112.57150268554688,112.44355010986328,28232000
A new type of autocorrect: technology is rewriting the global economic rulebook - Macquarie Group,https://news.google.com/rss/articles/CBMifGh0dHBzOi8vd3d3Lm1hY3F1YXJpZS5jb20vYXUvZW4vaW5zaWdodHMvYS1uZXctdHlwZS1vZi1hdXRvY29ycmVjdC10ZWNobm9sb2d5LWlzLXJld3JpdGluZy10aGUtZ2xvYmFsLWVjb25vbWljLXJ1bGVib29rLmh0bWzSAQA?oc=5,2022-06-29,new type autocorrect technology rewriting global economic rulebook macquarie group,0.11212121212121212,2022-06-29,112.14849853515624,113.66449737548828,111.5540008544922,112.25650024414062,112.12890625,18628000
Google Phases Out Free G Suite For Small Business - Investopedia,https://news.google.com/rss/articles/CBMiTWh0dHBzOi8vd3d3LmludmVzdG9wZWRpYS5jb20vZ29vZ2xlLXBoYXNlb3V0LWZyZWUtZW50ZXJwcmlzZS1zb2Z0d2FyZS01NDk5MDc20gEA?oc=5,2022-06-29,google phases free g suite small business investopedia,0.07500000000000001,2022-06-29,112.14849853515624,113.66449737548828,111.5540008544922,112.25650024414062,112.12890625,18628000
Google shares the secrets on how stability issues affect your app's success - Pocket Gamer.Biz,https://news.google.com/rss/articles/CBMiaWh0dHBzOi8vd3d3LnBvY2tldGdhbWVyLmJpei9nb29nbGUtc2hhcmVzLXRoZWlyLXNlY3JldHMtb24taG93LXN0YWJpbGl0eS1pc3N1ZXMtYWZmZWN0LXlvdXItYXBwcy1zdWNjZXNzL9IBAA?oc=5,2022-06-30,google shares secrets stability issues affect app success pocket gamer biz,0.3,2022-06-30,110.49949645996094,111.32980346679688,107.30999755859376,109.37249755859376,109.24817657470705,38046000
"After another rough quarter, could Netflix become an acquisition target? - Fast Company",https://news.google.com/rss/articles/CBMiS2h0dHBzOi8vd3d3LmZhc3Rjb21wYW55LmNvbS85MDc3MDI3MS9uZXRmbGl4LXEyLWVhcm5pbmdzLWFjcXVpc2l0aW9uLXRhcmdldNIBAA?oc=5,2022-07-19,another rough quarter could netflix become acquisition target fast company,0.05,2022-07-19,111.7300033569336,114.80999755859376,110.5,114.62000274658205,114.48971557617188,30992300
Tip Advisor: A Guide To Global Gratuities - Forbes,https://news.google.com/rss/articles/CBMiXGh0dHBzOi8vd3d3LmZvcmJlcy5jb20vdWsvYWR2aXNvci90cmF2ZWwtaW5zdXJhbmNlL3RpcC1hZHZpc29yLWEtZ3VpZGUtdG8tZ2xvYmFsLWdyYXR1aXRpZXMv0gEA?oc=5,2022-07-13,tip advisor guide global gratuities forbes,0.0,2022-07-13,112.63899993896484,115.15699768066406,111.822998046875,112.18699645996094,112.05947875976562,38958000
Traveller shares little-known trick for booking cheap flights on Google - 9Honey Travel,https://news.google.com/rss/articles/CBMie2h0dHBzOi8vdHJhdmVsLm5pbmUuY29tLmF1L2xhdGVzdC90aWt0b2stdmlkZW8tZ29vZ2xlLWZsaWdodHMtaGFjay1jaGVhcC1wbGFuZS10aWNrZXRzLzdhZTIwOTQ5LWZmMzQtNDNhYS05ZjE1LTFmMDg5ZDRjODU2NNIBRGh0dHBzOi8vYW1wLm5pbmUuY29tLmF1L2FydGljbGUvN2FlMjA5NDktZmYzNC00M2FhLTlmMTUtMWYwODlkNGM4NTY0?oc=5,2022-07-07,traveller shares little known trick booking cheap flights google 9honey travel,0.10625000000000001,2022-07-07,116.00800323486328,119.86199951171876,115.53399658203124,119.30599975585938,119.1703872680664,32184000
Google Cofounder Sergey Brin Just Gave Away Nearly $130 Million Worth Of Shares - Forbes,https://news.google.com/rss/articles/CBMihQFodHRwczovL3d3dy5mb3JiZXMuY29tL3NpdGVzL3JhY2hlbHNhbmRsZXIvMjAyMi8wOC8xMC9nb29nbGUtY29mb3VuZGVyLXNlcmdleS1icmluLWp1c3QtZ2F2ZS1hd2F5LW5lYXJseS0xMzAtbWlsbGlvbi13b3J0aC1vZi1zaGFyZXMv0gEA?oc=5,2022-08-10,google cofounder sergey brin gave away nearly 130 million worth shares forbes,0.2,2022-08-10,119.58999633789062,121.77999877929688,119.36000061035156,120.6500015258789,120.51286315917967,20497000
Zomato-Blinkit deal gets green signal; Google launches Street View in India - IndiaTimes,https://news.google.com/rss/articles/CBMimwFodHRwczovL20uZWNvbm9taWN0aW1lcy5jb20vdGVjaC9uZXdzbGV0dGVycy90ZWNoLXRvcC01L3pvbWF0by1ibGlua2l0LWRlYWwtZ2V0cy1ncmVlbi1zaWduYWwtZ29vZ2xlLWxhdW5jaGVzLXN0cmVldC12aWV3LWluLWluZGlhL2FydGljbGVzaG93LzkzMTY1MzY3LmNtc9IBnwFodHRwczovL20uZWNvbm9taWN0aW1lcy5jb20vdGVjaC9uZXdzbGV0dGVycy90ZWNoLXRvcC01L3pvbWF0by1ibGlua2l0LWRlYWwtZ2V0cy1ncmVlbi1zaWduYWwtZ29vZ2xlLWxhdW5jaGVzLXN0cmVldC12aWV3LWluLWluZGlhL2FtcF9hcnRpY2xlc2hvdy85MzE2NTM2Ny5jbXM?oc=5,2022-07-27,zomato blinkit deal gets green signal google launches street view india indiatimes,-0.2,2022-07-27,109.5999984741211,114.4000015258789,108.41999816894533,113.5999984741211,113.47087097167967,41474600
"Google stock had its best day of the year, after earnings weren't as bad as feared - CNBC",https://news.google.com/rss/articles/CBMiW2h0dHBzOi8vd3d3LmNuYmMuY29tLzIwMjIvMDcvMjcvZ29vZ2xlLXN0b2NrLWlzLWhhdmluZy1pdHMtc2Vjb25kLWJlc3QtZGF5LW9mLXRoZS15ZWFyLmh0bWzSAV9odHRwczovL3d3dy5jbmJjLmNvbS9hbXAvMjAyMi8wNy8yNy9nb29nbGUtc3RvY2staXMtaGF2aW5nLWl0cy1zZWNvbmQtYmVzdC1kYXktb2YtdGhlLXllYXIuaHRtbA?oc=5,2022-07-27,google stock best day year earnings bad feared cnbc,0.15000000000000008,2022-07-27,109.5999984741211,114.4000015258789,108.41999816894533,113.5999984741211,113.47087097167967,41474600
Google launches Street View in India with data sourced from local partners - Fortune India,https://news.google.com/rss/articles/CBMieWh0dHBzOi8vd3d3LmZvcnR1bmVpbmRpYS5jb20vZW50ZXJwcmlzZS9nb29nbGUtbGF1bmNoZXMtc3RyZWV0LXZpZXctaW4taW5kaWEtd2l0aC1kYXRhLXNvdXJjZWQtZnJvbS1sb2NhbC1wYXJ0bmVycy8xMDkwOTXSAYcBaHR0cHM6Ly93d3cuZm9ydHVuZWluZGlhLmNvbS9hbXAvc3RvcnkvZW50ZXJwcmlzZSUyRmdvb2dsZS1sYXVuY2hlcy1zdHJlZXQtdmlldy1pbi1pbmRpYS13aXRoLWRhdGEtc291cmNlZC1mcm9tLWxvY2FsLXBhcnRuZXJzJTJGMTA5MDk1?oc=5,2022-07-27,google launches street view india data sourced local partners fortune india,0.0,2022-07-27,109.5999984741211,114.4000015258789,108.41999816894533,113.5999984741211,113.47087097167967,41474600
"Guillermo Albizuri, Managing Director – Travel, Finance, Education and Startups of Google Spain - The CEO Magazine",https://news.google.com/rss/articles/CBMiVmh0dHBzOi8vd3d3LnRoZWNlb21hZ2F6aW5lLmNvbS9leGVjdXRpdmUtaW50ZXJ2aWV3cy9pdC1lbGVjdHJvbmljcy9ndWlsbGVybW8tYWxiaXp1cmkv0gEA?oc=5,2022-07-27,guillermo albizuri managing director travel finance education startups google spain ceo magazine,0.0,2022-07-27,109.5999984741211,114.4000015258789,108.41999816894533,113.5999984741211,113.47087097167967,41474600
Google shares first glimpse of new Midtown Atlanta offices - WSB Atlanta,https://news.google.com/rss/articles/CBMihQFodHRwczovL3d3dy53c2J0di5jb20vdmlkZW8vbG9jYWwtdmlkZW8vZ29vZ2xlLXNoYXJlcy1maXJzdC1nbGltcHNlLW5ldy1taWR0b3duLWF0bGFudGEtb2ZmaWNlcy80MTNiZWVlYy0xYzc5LTQxYmUtODQyYi1hZTgxMzE5NTU2Y2Uv0gEA?oc=5,2022-07-27,google shares first glimpse new midtown atlanta offices wsb atlanta,0.19318181818181818,2022-07-27,109.5999984741211,114.4000015258789,108.41999816894533,113.5999984741211,113.47087097167967,41474600
Best Google Stock Trading Brokers - TradingPedia,https://news.google.com/rss/articles/CBMiSGh0dHBzOi8vd3d3LnRyYWRpbmdwZWRpYS5jb20vc3RvY2stYnJva2Vycy9nb29nbGUtc3RvY2stdHJhZGluZy1icm9rZXJzL9IBAA?oc=5,2022-08-01,best google stock trading brokers tradingpedia,1.0,2022-08-01,115.52999877929688,117.12000274658205,114.69000244140624,115.4800033569336,115.34873962402344,22856200
"Pinterest (PINS) Stock Jumps After Sales, User Numbers Show Resilience - Bloomberg",https://news.google.com/rss/articles/CBMia2h0dHBzOi8vd3d3LmJsb29tYmVyZy5jb20vbmV3cy9hcnRpY2xlcy8yMDIyLTA4LTAxL3BpbnRlcmVzdC1qdW1wcy1hZnRlci1zYWxlcy11c2VyLW51bWJlcnMtc2hvdy1yZXNpbGllbmNl0gEA?oc=5,2022-08-01,pinterest pins stock jumps sales user numbers show resilience bloomberg,0.0,2022-08-01,115.52999877929688,117.12000274658205,114.69000244140624,115.4800033569336,115.34873962402344,22856200
"Apple, Google, Meta: All of the tech companies hitting the brakes on hiring - Yahoo Finance",https://news.google.com/rss/articles/CBMifmh0dHBzOi8vZmluYW5jZS55YWhvby5jb20vbmV3cy90ZXNsYS1hcHBsZS1taWNyb3NvZnQtcGVsb3Rvbi1hbGwtb2YtdGVjaC1jb21wYW5pZXMtaGl0dGluZy10aGUtYnJha2VzLW9uLWhpcmluZy0yMDI0Mjg2MjguaHRtbNIBAA?oc=5,2022-08-01,apple google meta tech companies hitting brakes hiring yahoo finance,0.0,2022-08-01,115.52999877929688,117.12000274658205,114.69000244140624,115.4800033569336,115.34873962402344,22856200
"Stock Market Highlights: Sensex rebounds 859 pts from day's low amid volatile trade and Nifty surpasses 17,550 - CNBCTV18",https://news.google.com/rss/articles/CBMid2h0dHBzOi8vd3d3LmNuYmN0djE4LmNvbS9tYXJrZXQvc3RvY2stbWFya2V0LWxpdmUtdXBkYXRlLXNoYXJlLXRvZGF5LW5pZnR5LXNlbnNleC1nb29nbGUtbmV0ZmxpeC1zeXJtYS1nbXAtMTQ1NjM1MzIuaHRt0gF7aHR0cHM6Ly93d3cuY25iY3R2MTguY29tL21hcmtldC9zdG9jay1tYXJrZXQtbGl2ZS11cGRhdGUtc2hhcmUtdG9kYXktbmlmdHktc2Vuc2V4LWdvb2dsZS1uZXRmbGl4LXN5cm1hLWdtcC0xNDU2MzUzMi5odG0vYW1w?oc=5,2022-08-23,stock market highlights sensex rebounds 859 pts day low amid volatile trade nifty surpasses 17 550 cnbctv18,0.0,2022-08-23,114.31999969482422,115.93000030517578,114.3000030517578,114.7699966430664,114.63954162597656,14390700
