title,link,pub_date,cleaned_text,sentiment,Date,Open,High,Low,Close,Adj Close,Volume
"Google workers form new labour union, a tech industry rarity - Moneycontrol",https://news.google.com/rss/articles/CBMic2h0dHBzOi8vd3d3Lm1vbmV5Y29udHJvbC5jb20vbmV3cy9idXNpbmVzcy9nb29nbGUtd29ya2Vycy1mb3JtLW5ldy1sYWJvdXItdW5pb24tYS10ZWNoLWluZHVzdHJ5LXJhcml0eS02MzAzNDMxLmh0bWzSAXdodHRwczovL3d3dy5tb25leWNvbnRyb2wuY29tL25ld3MvYnVzaW5lc3MvZ29vZ2xlLXdvcmtlcnMtZm9ybS1uZXctbGFib3VyLXVuaW9uLWEtdGVjaC1pbmR1c3RyeS1yYXJpdHktNjMwMzQzMS5odG1sL2FtcA?oc=5,2021-01-04,google workers form new labour union tech industry rarity moneycontrol,0.13636363636363635,2021-01-04,87.87699890136719,88.03250122070312,85.39250183105469,86.41200256347656,86.31378173828125,38038000
Google workers have formed the company's first-ever union - CNN,https://news.google.com/rss/articles/CBMiRGh0dHBzOi8vd3d3LmNubi5jb20vMjAyMS8wMS8wNC90ZWNoL2dvb2dsZS1hbHBoYWJldC11bmlvbi9pbmRleC5odG1s0gE9aHR0cHM6Ly9hbXAuY25uLmNvbS9jbm4vMjAyMS8wMS8wNC90ZWNoL2dvb2dsZS1hbHBoYWJldC11bmlvbg?oc=5,2021-01-04,google workers formed company first ever union cnn,0.25,2021-01-04,87.87699890136719,88.03250122070312,85.39250183105469,86.41200256347656,86.31378173828125,38038000
Google removes 30 loan apps from Play store after RBI red flag - IndiaTimes,https://news.google.com/rss/articles/CBMilQFodHRwczovL20uZWNvbm9taWN0aW1lcy5jb20vdGVjaC90ZWNobm9sb2d5L2dvb2dsZS1yZW1vdmVzLXBlcnNvbmFsLWxvYW4tYXBwcy12aW9sYXRpbmctdXNlci1zYWZldHktcG9saWNpZXMtZnJvbS1wbGF5LXN0b3JlL2FydGljbGVzaG93LzgwMjY3MDQzLmNtc9IBmQFodHRwczovL20uZWNvbm9taWN0aW1lcy5jb20vdGVjaC90ZWNobm9sb2d5L2dvb2dsZS1yZW1vdmVzLXBlcnNvbmFsLWxvYW4tYXBwcy12aW9sYXRpbmctdXNlci1zYWZldHktcG9saWNpZXMtZnJvbS1wbGF5LXN0b3JlL2FtcF9hcnRpY2xlc2hvdy84MDI2NzA0My5jbXM?oc=5,2021-01-14,google removes 30 loan apps play store rbi red flag indiatimes,0.0,2021-01-14,87.68099975585938,88.75050354003906,86.66999816894531,87.00900268554688,86.91010284423828,23590000
NLP in Finance: Question Answering - Towards Data Science,https://news.google.com/rss/articles/CBMiggFodHRwczovL3Rvd2FyZHNkYXRhc2NpZW5jZS5jb20vaG93LXRvLWJ1aWxkLWEtcHJvZHVjdGlvbi1yZWFkeS1maW5hbmNpYWwtcXVlc3Rpb24tYW5zd2VyaW5nLXN5c3RlbS13aXRoLWppbmEtYW5kLWJlcnQtNDgzMzUxMDMwNDNm0gEA?oc=5,2021-01-14,nlp finance question answering towards data science,0.0,2021-01-14,87.68099975585938,88.75050354003906,86.66999816894531,87.00900268554688,86.91010284423828,23590000
Fitbit Closes $2.1 Billion Google Merger - TheStreet,https://news.google.com/rss/articles/CBMiWWh0dHBzOi8vd3d3LnRoZXN0cmVldC5jb20vaW52ZXN0aW5nL2ZpdGJpdC1jbG9zZXMtMi0xLWJpbGxpb24tZ29vZ2xlLW1lcmdlci1zaGFyZXMtaGFsdGVk0gEA?oc=5,2021-01-14,fitbit closes 2 1 billion google merger thestreet,0.0,2021-01-14,87.68099975585938,88.75050354003906,86.66999816894531,87.00900268554688,86.91010284423828,23590000
"Epic Widens Fortnite Dispute With Apple, Google in U.K. - Bloomberg",https://news.google.com/rss/articles/CBMib2h0dHBzOi8vd3d3LmJsb29tYmVyZy5jb20vbmV3cy9hcnRpY2xlcy8yMDIxLTAxLTE0L2VwaWMtd2lkZW5zLWZvcnRuaXRlLWFjY2Vzcy1kaXNwdXRlLXdpdGgtYXBwbGUtZ29vZ2xlLWluLXUta9IBAA?oc=5,2021-01-14,epic widens fortnite dispute apple google u k bloomberg,0.1,2021-01-14,87.68099975585938,88.75050354003906,86.66999816894531,87.00900268554688,86.91010284423828,23590000
"Betting on Bitcoin is better than investing in PayPal, Google, Facebook, Amazon - Nairametrics",https://news.google.com/rss/articles/CBMicWh0dHBzOi8vbmFpcmFtZXRyaWNzLmNvbS8yMDIxLzAxLzE0L2JldHRpbmctb24tYml0Y29pbi1pcy1iZXR0ZXItdGhhbi1pbnZlc3RpbmctaW4tcGF5cGFsLWdvb2dsZS1mYWNlYm9vay1hbWF6b24v0gF3aHR0cHM6Ly9uYWlyYW1ldHJpY3MuY29tLzIwMjEvMDEvMTQvYmV0dGluZy1vbi1iaXRjb2luLWlzLWJldHRlci10aGFuLWludmVzdGluZy1pbi1wYXlwYWwtZ29vZ2xlLWZhY2Vib29rLWFtYXpvbi8_YW1wPTE?oc=5,2021-01-14,betting bitcoin better investing paypal google facebook amazon nairametrics,0.5,2021-01-14,87.68099975585938,88.75050354003906,86.66999816894531,87.00900268554688,86.91010284423828,23590000
Is your measurement plan future-proof - Think with Google,https://news.google.com/rss/articles/CBMibWh0dHBzOi8vd3d3LnRoaW5rd2l0aGdvb2dsZS5jb20vbWFya2V0aW5nLXN0cmF0ZWdpZXMvZGF0YS1hbmQtbWVhc3VyZW1lbnQvZGlnaXRhbC1tYXJrZXRpbmctbWVhc3VyZW1lbnQtcGxhbi_SAQA?oc=5,2021-01-19,measurement plan future proof think google,0.0,2021-01-19,87.61250305175781,90.46375274658205,87.072998046875,89.54299926757812,89.44121551513672,34692000
The man who could have made $1 billion in Google shares - but turned it down - ZDNet,https://news.google.com/rss/articles/CBMiaGh0dHBzOi8vd3d3LnpkbmV0LmNvbS9hcnRpY2xlL3RoZS1tYW4td2hvLWNvdWxkLWhhdmUtbWFkZS0xLWJpbGxpb24taW4tZ29vZ2xlLXNoYXJlcy1idXQtdHVybmVkLWl0LWRvd24v0gEA?oc=5,2021-01-27,man could made 1 billion google shares turned zdnet,0.0,2021-01-27,94.12650299072266,94.5,90.4499969482422,91.53949737548828,91.4354476928711,54966000
GameStop Has Overtaken Tesla on Google Finance | Market Insights - TradeStation Market Insights,https://news.google.com/rss/articles/CBMiUmh0dHBzOi8vd3d3LnRyYWRlc3RhdGlvbi5jb20vaW5zaWdodHMvMjAyMS8wMS8yNy9nYW1lc3RvcC12cy10ZXNsYS1nb29nbGUtZmluYW5jZS_SAQA?oc=5,2021-01-27,gamestop overtaken tesla google finance market insights tradestation market insights,0.0,2021-01-27,94.12650299072266,94.5,90.4499969482422,91.53949737548828,91.4354476928711,54966000
Google Maps now has transliteration for 10 Indian languages - Moneycontrol,https://news.google.com/rss/articles/CBMidWh0dHBzOi8vd3d3Lm1vbmV5Y29udHJvbC5jb20vbmV3cy90ZWNobm9sb2d5L2dvb2dsZS1tYXBzLW5vdy1oYXMtdHJhbnNsaXRlcmF0aW9uLWZvci0xMC1pbmRpYW4tbGFuZ3VhZ2VzLTY0MDM3OTEuaHRtbNIBeWh0dHBzOi8vd3d3Lm1vbmV5Y29udHJvbC5jb20vbmV3cy90ZWNobm9sb2d5L2dvb2dsZS1tYXBzLW5vdy1oYXMtdHJhbnNsaXRlcmF0aW9uLWZvci0xMC1pbmRpYW4tbGFuZ3VhZ2VzLTY0MDM3OTEuaHRtbC9hbXA?oc=5,2021-01-27,google maps transliteration 10 indian languages moneycontrol,0.0,2021-01-27,94.12650299072266,94.5,90.4499969482422,91.53949737548828,91.4354476928711,54966000
What is Cash app? The easy way Redditors trade stocks - Mashable,https://news.google.com/rss/articles/CBMiL2h0dHBzOi8vbWFzaGFibGUuY29tL2FydGljbGUvY2FzaC1hcHAtZXhwbGFpbmVy0gEA?oc=5,2021-01-27,cash app easy way redditors trade stocks mashable,0.43333333333333335,2021-01-27,94.12650299072266,94.5,90.4499969482422,91.53949737548828,91.4354476928711,54966000
Google removes finance-based mobile applications from Play store after RBI red flag - Firstpost,https://news.google.com/rss/articles/CBMijQFodHRwczovL3d3dy5maXJzdHBvc3QuY29tL3RlY2gvbmV3cy1hbmFseXNpcy9nb29nbGUtcmVtb3Zlcy1maW5hbmNlLWJhc2VkLW1vYmlsZS1hcHBsaWNhdGlvbnMtZnJvbS1wbGF5LXN0b3JlLWFmdGVyLXJiaS1yZWQtZmxhZy05MjA1NzQxLmh0bWzSAZEBaHR0cHM6Ly93d3cuZmlyc3Rwb3N0LmNvbS90ZWNoL25ld3MtYW5hbHlzaXMvZ29vZ2xlLXJlbW92ZXMtZmluYW5jZS1iYXNlZC1tb2JpbGUtYXBwbGljYXRpb25zLWZyb20tcGxheS1zdG9yZS1hZnRlci1yYmktcmVkLWZsYWctOTIwNTc0MS5odG1sL2FtcA?oc=5,2021-01-21,google removes finance based mobile applications play store rbi red flag firstpost,0.0,2021-01-21,94.9000015258789,96.74299621582033,94.35549926757812,94.5625,94.45501708984376,41278000
"Naver founder to target Google, Alibaba and Amazon - 코리아타임스",https://news.google.com/rss/articles/CBMiPWh0dHBzOi8vd3d3LmtvcmVhdGltZXMuY28ua3Ivd3d3L3RlY2gvMjAyNC8wNi8xMjlfMjk1MDM3Lmh0bWzSAT9odHRwczovL20ua29yZWF0aW1lcy5jby5rci9wYWdlcy9hcnRpY2xlLmFtcC5hc3A_bmV3c0lkeD0yOTUwMzc?oc=5,2021-01-21,naver founder target google alibaba amazon 코리아타임스,0.0,2021-01-21,94.9000015258789,96.74299621582033,94.35549926757812,94.5625,94.45501708984376,41278000
Download Samsung Galaxy S21 Ultra Stock Wallpapers [4K Res] - YTECHB,https://news.google.com/rss/articles/CBMiNWh0dHBzOi8vd3d3Lnl0ZWNoYi5jb20vc2Ftc3VuZy1nYWxheHktczIxLXdhbGxwYXBlcnMv0gEA?oc=5,2021-01-21,download samsung galaxy s21 ultra stock wallpapers 4k res ytechb,0.0,2021-01-21,94.9000015258789,96.74299621582033,94.35549926757812,94.5625,94.45501708984376,41278000
How to invest in stocks of best global brands from India - The Financial Express,https://news.google.com/rss/articles/CBMifGh0dHBzOi8vd3d3LmZpbmFuY2lhbGV4cHJlc3MuY29tL2J1c2luZXNzL2ludmVzdGluZy1hYnJvYWQtaG93LXRvLWludmVzdC1pbi1zdG9ja3Mtb2YtYmVzdC1nbG9iYWwtYnJhbmRzLWZyb20taW5kaWEtMjE3NDg0NC_SAYEBaHR0cHM6Ly93d3cuZmluYW5jaWFsZXhwcmVzcy5jb20vYnVzaW5lc3MvaW52ZXN0aW5nLWFicm9hZC1ob3ctdG8taW52ZXN0LWluLXN0b2Nrcy1vZi1iZXN0LWdsb2JhbC1icmFuZHMtZnJvbS1pbmRpYS0yMTc0ODQ0L2xpdGUv?oc=5,2021-01-20,invest stocks best global brands india financial express,0.3333333333333333,2021-01-20,91.572998046875,95.1855010986328,91.27649688720705,94.34500122070312,94.23776245117188,49806000
"Top-10 TV shows in 2020, as per Google searches - Moneycontrol",https://news.google.com/rss/articles/CBMia2h0dHBzOi8vd3d3Lm1vbmV5Y29udHJvbC5jb20vbmV3cy9waG90b3MvdHJlbmRzL3RvcC0xMC10di1zaG93cy1pbi0yMDIwLWFzLXBlci1nb29nbGUtc2VhcmNoZXMtNjM2OTc5MS5odG1s0gFvaHR0cHM6Ly93d3cubW9uZXljb250cm9sLmNvbS9uZXdzL3Bob3Rvcy90cmVuZHMvdG9wLTEwLXR2LXNob3dzLWluLTIwMjAtYXMtcGVyLWdvb2dsZS1zZWFyY2hlcy02MzY5NzkxLmh0bWwvYW1w?oc=5,2021-01-20,top 10 tv shows 2020 per google searches moneycontrol,0.5,2021-01-20,91.572998046875,95.1855010986328,91.27649688720705,94.34500122070312,94.23776245117188,49806000
Cyberpunk 2077 is devastating CDPR as stocks tumble 50% - Sportskeeda,https://news.google.com/rss/articles/CBMiU2h0dHBzOi8vd3d3LnNwb3J0c2tlZWRhLmNvbS9lc3BvcnRzL25ld3MtY3liZXJwdW5rLTIwNzctY29zdGluZy1jZHByLXN0b2Nrcy10by10YW5r0gEA?oc=5,2021-01-20,cyberpunk 2077 devastating cdpr stocks tumble 50 sportskeeda,-1.0,2021-01-20,91.572998046875,95.1855010986328,91.27649688720705,94.34500122070312,94.23776245117188,49806000
"Tri-Spine Horseshoe Crab Aquaculture, Ranching and Stock Enhancement: Perspectives and Challenges - Frontiers",https://news.google.com/rss/articles/CBMiPmh0dHBzOi8vd3d3LmZyb250aWVyc2luLm9yZy9hcnRpY2xlcy8xMC4zMzg5L2ZtYXJzLjIwMjEuNjA4MTU10gEA?oc=5,2021-01-13,tri spine horseshoe crab aquaculture ranching stock enhancement perspectives challenges frontiers,0.0,2021-01-13,86.92900085449219,88.25174713134766,86.90049743652344,87.72000122070312,87.62029266357422,21882000
"Quickfire Questions: Tim Hassett, CEO Unlimited – Forbes Advisor UK - Forbes",https://news.google.com/rss/articles/CBMibGh0dHBzOi8vd3d3LmZvcmJlcy5jb20vdWsvYWR2aXNvci9wZXJzb25hbC1maW5hbmNlLzIwMjEvMDEvMTMvcXVpY2tmaXJlLXF1ZXN0aW9ucy10aW0taGFzc2V0dC1jZW8tdW5saW1pdGVkL9IBAA?oc=5,2021-01-13,quickfire questions tim hassett ceo unlimited forbes advisor uk forbes,0.0,2021-01-13,86.92900085449219,88.25174713134766,86.90049743652344,87.72000122070312,87.62029266357422,21882000
"Tesla’s most searched Google terms of 2020: Stock, Net Worth, and Baby Names - TESLARATI",https://news.google.com/rss/articles/CBMiOGh0dHBzOi8vd3d3LnRlc2xhcmF0aS5jb20vdGVzbGEtZ29vZ2xlLXBlcmZvcm1hbmNlLTIwMjAv0gE8aHR0cHM6Ly93d3cudGVzbGFyYXRpLmNvbS90ZXNsYS1nb29nbGUtcGVyZm9ybWFuY2UtMjAyMC9hbXAv?oc=5,2021-01-13,tesla searched google terms 2020 stock net worth baby names teslarati,0.15,2021-01-13,86.92900085449219,88.25174713134766,86.90049743652344,87.72000122070312,87.62029266357422,21882000
"Biodiversity response to forest management intensity, carbon stocks and net primary production in temperate montane ... - Nature.com",https://news.google.com/rss/articles/CBMiMmh0dHBzOi8vd3d3Lm5hdHVyZS5jb20vYXJ0aWNsZXMvczQxNTk4LTAyMC04MDQ5OS000gEA?oc=5,2021-01-15,biodiversity response forest management intensity carbon stocks net primary production temperate montane nature com,0.2,2021-01-15,86.90950012207031,87.80000305175781,86.07749938964844,86.80950164794922,86.71083068847656,26844000
"John Abraham shares pic of his muscular arm, fan calls it 'Google maps' - Hindustan Times",https://news.google.com/rss/articles/CBMivwFodHRwczovL3d3dy5oaW5kdXN0YW50aW1lcy5jb20vZW50ZXJ0YWlubWVudC9ib2xseXdvb2Qvam9obi1hYnJhaGFtLXNoYXJlcy1waWMtb2YtaGlzLW11c2N1bGFyLWFybS10aWdlci1zaHJvZmYtY3JpZXMtaW5zYW5lLW1pbGFwLXphdmVyaS1jYWxscy1pdC1qb2huLXMtaGF0aG9kYS1zZWUtaGVyZS0xMDE2MTA2OTc0MDQzOTcuaHRtbNIBwwFodHRwczovL3d3dy5oaW5kdXN0YW50aW1lcy5jb20vZW50ZXJ0YWlubWVudC9ib2xseXdvb2Qvam9obi1hYnJhaGFtLXNoYXJlcy1waWMtb2YtaGlzLW11c2N1bGFyLWFybS10aWdlci1zaHJvZmYtY3JpZXMtaW5zYW5lLW1pbGFwLXphdmVyaS1jYWxscy1pdC1qb2huLXMtaGF0aG9kYS1zZWUtaGVyZS0xMDE2MTA2OTc0MDQzOTctYW1wLmh0bWw?oc=5,2021-01-15,john abraham shares pic muscular arm fan calls google maps hindustan times,0.0,2021-01-15,86.90950012207031,87.80000305175781,86.07749938964844,86.80950164794922,86.71083068847656,26844000
Crossbeam raises $25M to back platform economy startups - TechCrunch,https://news.google.com/rss/articles/CBMiN2h0dHBzOi8vdGVjaGNydW5jaC5jb20vMjAyMS8wMS8xNS9jcm9zc2JlYW0tZmlyc3QtZnVuZC_SAQA?oc=5,2021-01-15,crossbeam raises 25m back platform economy startups techcrunch,0.0,2021-01-15,86.90950012207031,87.80000305175781,86.07749938964844,86.80950164794922,86.71083068847656,26844000
"Dr. Martens, Moonpig Mull Market Debuts - So What Exactly Is An IPO? - Forbes",https://news.google.com/rss/articles/CBMifmh0dHBzOi8vd3d3LmZvcmJlcy5jb20vdWsvYWR2aXNvci9wZXJzb25hbC1maW5hbmNlLzIwMjEvMDEvMTUvZHItbWFydGVucy1tb29ucGlnLW11bGwtbWFya2V0LWRlYnV0cy1zby13aGF0LWV4YWN0bHktaXMtYW4taXBvL9IBAA?oc=5,2021-01-15,dr martens moonpig mull market debuts exactly ipo forbes,0.25,2021-01-15,86.90950012207031,87.80000305175781,86.07749938964844,86.80950164794922,86.71083068847656,26844000
"10 of the Smartest Stocks to Buy with Just $5,000 to Spend - InvestorPlace",https://news.google.com/rss/articles/CBMiQ2h0dHBzOi8vaW52ZXN0b3JwbGFjZS5jb20vMjAyMS8wMS8xMC1zbWFydC1zdG9ja3MtdG8tYnV5LXdpdGgtNTAwMC_SAQA?oc=5,2021-01-15,10 smartest stocks buy 5 000 spend investorplace,0.0,2021-01-15,86.90950012207031,87.80000305175781,86.07749938964844,86.80950164794922,86.71083068847656,26844000
Why You Should Stop Using Your Default Android Browser - MUO - MakeUseOf,https://news.google.com/rss/articles/CBMiUWh0dHBzOi8vd3d3Lm1ha2V1c2VvZi5jb20vd2h5LXlvdS1zaG91bGQtc3RvcC11c2luZy15b3VyLWRlZmF1bHQtYW5kcm9pZC1icm93c2VyL9IBAA?oc=5,2021-01-15,stop using default android browser muo makeuseof,0.0,2021-01-15,86.90950012207031,87.80000305175781,86.07749938964844,86.80950164794922,86.71083068847656,26844000
Why Is Fitbit Stock Untradeable? - Market Realist,https://news.google.com/rss/articles/CBMiPGh0dHBzOi8vbWFya2V0cmVhbGlzdC5jb20vcC93aHktaXMtZml0Yml0LXN0b2NrLXVudHJhZGVhYmxlL9IBAA?oc=5,2021-01-15,fitbit stock untradeable market realist,0.0,2021-01-15,86.90950012207031,87.80000305175781,86.07749938964844,86.80950164794922,86.71083068847656,26844000
Google halts Play Store 'review bombing' by GameStop traders - BBC.com,https://news.google.com/rss/articles/CBMiLGh0dHBzOi8vd3d3LmJiYy5jb20vbmV3cy90ZWNobm9sb2d5LTU1ODUzNTY40gEwaHR0cHM6Ly93d3cuYmJjLmNvbS9uZXdzL3RlY2hub2xvZ3ktNTU4NTM1NjguYW1w?oc=5,2021-01-29,google halts play store review bombing gamestop traders bbc com,0.0,2021-01-29,92.30850219726562,92.86399841308594,90.51000213623048,91.78700256347656,91.68267059326172,32252000
Google salvaged Robinhood's one-star rating by deleting nearly 100000 negative reviews - The Verge,https://news.google.com/rss/articles/CBMiXGh0dHBzOi8vd3d3LnRoZXZlcmdlLmNvbS8yMDIxLzEvMjgvMjIyNTUyNDUvZ29vZ2xlLWRlbGV0aW5nLWJhZC1yb2Jpbmhvb2QtcmV2aWV3cy1wbGF5LXN0b3Jl0gEA?oc=5,2021-01-29,google salvaged robinhood one star rating deleting nearly 100000 negative reviews verge,-0.09999999999999999,2021-01-29,92.30850219726562,92.86399841308594,90.51000213623048,91.78700256347656,91.68267059326172,32252000
Google rescues Robinhood from a flood of negative Play Store reviews - Android Authority,https://news.google.com/rss/articles/CBMiRWh0dHBzOi8vd3d3LmFuZHJvaWRhdXRob3JpdHkuY29tL3JvYmluaG9vZC1nb29nbGUtcGxheS1zdG9yZS0xMTk2NjY4L9IBAA?oc=5,2021-01-29,google rescues robinhood flood negative play store reviews android authority,-0.3,2021-01-29,92.30850219726562,92.86399841308594,90.51000213623048,91.78700256347656,91.68267059326172,32252000
Why Google Deleted Thousands Of Negative Robinhood Play Store Reviews - Screen Rant,https://news.google.com/rss/articles/CBMiXmh0dHBzOi8vc2NyZWVucmFudC5jb20vZ29vZ2xlLXJvYmluaG9vZC1uZWdhdGl2ZS1hcHAtcmV2aWV3cy1kZWxldGVkLXBsYXktc3RvcmUtd2h5LWV4cGxhaW5lZC_SAQA?oc=5,2021-01-29,google deleted thousands negative robinhood play store reviews screen rant,-0.3,2021-01-29,92.30850219726562,92.86399841308594,90.51000213623048,91.78700256347656,91.68267059326172,32252000
"What you need to know about short selling, the method that propelled GameStop's stocks to new heights - GMA Network",https://news.google.com/rss/articles/CBMirgFodHRwczovL3d3dy5nbWFuZXR3b3JrLmNvbS9lbnRlcnRhaW5tZW50L2NlbGVicml0eWxpZmUvaG9iYmllcy83Mzc1OS93aGF0LXlvdS1uZWVkLXRvLWtub3ctYWJvdXQtc2hvcnQtc2VsbGluZy10aGUtbWV0aG9kLXRoYXQtcHJvcGVsbGVkLWdhbWVzdG9wcy1zdG9ja3MtdG8tbmV3LWhlaWdodHMvc3RvcnnSAbIBaHR0cHM6Ly93d3cuZ21hbmV0d29yay5jb20vZW50ZXJ0YWlubWVudC9jZWxlYnJpdHlsaWZlL2hvYmJpZXMvNzM3NTkvd2hhdC15b3UtbmVlZC10by1rbm93LWFib3V0LXNob3J0LXNlbGxpbmctdGhlLW1ldGhvZC10aGF0LXByb3BlbGxlZC1nYW1lc3RvcHMtc3RvY2tzLXRvLW5ldy1oZWlnaHRzL3N0b3J5P2FtcA?oc=5,2021-01-29,need know short selling method propelled gamestop stocks new heights gma network,0.06818181818181818,2021-01-29,92.30850219726562,92.86399841308594,90.51000213623048,91.78700256347656,91.68267059326172,32252000
Google deletes negative reviews of Robinhood app - The Hill,https://news.google.com/rss/articles/CBMiXmh0dHBzOi8vdGhlaGlsbC5jb20vcG9saWN5L3RlY2hub2xvZ3kvNTM2NTA4LWdvb2dsZS1kZWxldGVzLW5lZ2F0aXZlLXJldmlld3Mtb2Ytcm9iaW5ob29kLWFwcC_SAWJodHRwczovL3RoZWhpbGwuY29tL3BvbGljeS90ZWNobm9sb2d5LzUzNjUwOC1nb29nbGUtZGVsZXRlcy1uZWdhdGl2ZS1yZXZpZXdzLW9mLXJvYmluaG9vZC1hcHAvYW1wLw?oc=5,2021-01-29,google deletes negative reviews robinhood app hill,-0.3,2021-01-29,92.30850219726562,92.86399841308594,90.51000213623048,91.78700256347656,91.68267059326172,32252000
Aussie stocks rebound strongly after wiping $40 billion yesterday - 9News,https://news.google.com/rss/articles/CBMieWh0dHBzOi8vd3d3LjluZXdzLmNvbS5hdS9uYXRpb25hbC9hc3gtMjAwLWF1c3NpZS1zdG9ja3MtcmVib3VuZC1hZnRlci1ob3Jyb3Itc2Vzc2lvbi85MGFiNGYxZC1lMmJiLTRjZGQtOTAwNy04NzU2MzBkNjY3NDLSAUVodHRwczovL2FtcC45bmV3cy5jb20uYXUvYXJ0aWNsZS85MGFiNGYxZC1lMmJiLTRjZGQtOTAwNy04NzU2MzBkNjY3NDI?oc=5,2021-01-29,aussie stocks rebound strongly wiping 40 billion yesterday 9news,0.4333333333333333,2021-01-29,92.30850219726562,92.86399841308594,90.51000213623048,91.78700256347656,91.68267059326172,32252000
Republic day: Google doodle captures vibrant heritage of India | Today News - Mint,https://news.google.com/rss/articles/CBMidWh0dHBzOi8vd3d3LmxpdmVtaW50LmNvbS9uZXdzL2luZGlhL3JlcHVibGljLWRheS1nb29nbGUtZG9vZGxlLWNhcHR1cmVzLXZpYnJhbnQtaGVyaXRhZ2Utb2YtaW5kaWEtMTE2MTE2MzA5MTUyNTYuaHRtbNIBeWh0dHBzOi8vd3d3LmxpdmVtaW50LmNvbS9uZXdzL2luZGlhL3JlcHVibGljLWRheS1nb29nbGUtZG9vZGxlLWNhcHR1cmVzLXZpYnJhbnQtaGVyaXRhZ2Utb2YtaW5kaWEvYW1wLTExNjExNjMwOTE1MjU2Lmh0bWw?oc=5,2021-01-26,republic day google doodle captures vibrant heritage india today news mint,0.16666666666666666,2021-01-26,94.44200134277344,96.25,94.21224975585938,95.86199951171876,95.75303649902344,26262000
[Update: Final] Google Home Max officially discontinued after going out of stock - 9to5Google,https://news.google.com/rss/articles/CBMiP2h0dHBzOi8vOXRvNWdvb2dsZS5jb20vMjAyMS8wMS8yNi9nb29nbGUtaG9tZS1tYXgtZGlzY29udGludWVkL9IBAA?oc=5,2021-01-26,update final google home max officially discontinued going stock 9to5google,0.0,2021-01-26,94.44200134277344,96.25,94.21224975585938,95.86199951171876,95.75303649902344,26262000
"Quickfire Questions: Christal Bemont, CEO @ Talend – Forbes Advisor UK - Forbes",https://news.google.com/rss/articles/CBMibWh0dHBzOi8vd3d3LmZvcmJlcy5jb20vdWsvYWR2aXNvci9wZXJzb25hbC1maW5hbmNlLzIwMjEvMDEvMjUvcXVpY2tmaXJlLXF1ZXN0aW9ucy1jaHJpc3RhbC1iZW1vbnQtY2VvLXRhbGVuZC_SAQA?oc=5,2021-01-26,quickfire questions christal bemont ceo talend forbes advisor uk forbes,0.0,2021-01-26,94.44200134277344,96.25,94.21224975585938,95.86199951171876,95.75303649902344,26262000
The stock market is not the economy. Right? Here's what research says. - Journalist's Resource,https://news.google.com/rss/articles/CBMiPmh0dHBzOi8vam91cm5hbGlzdHNyZXNvdXJjZS5vcmcvaG9tZS9zdG9jay1tYXJrZXQtbm90LWVjb25vbXkv0gEA?oc=5,2021-01-11,stock market economy right research says journalist resource,0.2857142857142857,2021-01-11,89.30349731445312,89.71575164794922,88.0260009765625,88.33599853515625,88.23558807373047,24194000
Google Search on mobile is getting a facelift; all you need to know - Moneycontrol,https://news.google.com/rss/articles/CBMifGh0dHBzOi8vd3d3Lm1vbmV5Y29udHJvbC5jb20vbmV3cy90ZWNobm9sb2d5L2dvb2dsZS1zZWFyY2gtb24tbW9iaWxlLWlzLWdldHRpbmctYS1mYWNlbGlmdC1hbGwteW91LW5lZWQtdG8ta25vdy02Mzk1MDAxLmh0bWzSAYABaHR0cHM6Ly93d3cubW9uZXljb250cm9sLmNvbS9uZXdzL3RlY2hub2xvZ3kvZ29vZ2xlLXNlYXJjaC1vbi1tb2JpbGUtaXMtZ2V0dGluZy1hLWZhY2VsaWZ0LWFsbC15b3UtbmVlZC10by1rbm93LTYzOTUwMDEuaHRtbC9hbXA?oc=5,2021-01-25,google search mobile getting facelift need know moneycontrol,0.0,2021-01-25,96.03350067138672,96.47899627685548,93.37650299072266,94.97000122070312,94.86205291748048,38546000
Better Buy: Facebook vs. Google - The Motley Fool,https://news.google.com/rss/articles/CBMiSGh0dHBzOi8vd3d3LmZvb2wuY29tL2ludmVzdGluZy8yMDIxLzAxLzI1L2JldHRlci1idXktZmFjZWJvb2stdnMtZ29vZ2xlL9IBAA?oc=5,2021-01-25,better buy facebook vs google motley fool,0.55,2021-01-25,96.03350067138672,96.47899627685548,93.37650299072266,94.97000122070312,94.86205291748048,38546000
Google Maps Search Trends For January 2021 - Search Engine Journal,https://news.google.com/rss/articles/CBMiVmh0dHBzOi8vd3d3LnNlYXJjaGVuZ2luZWpvdXJuYWwuY29tL2dvb2dsZS1tYXBzLXNlYXJjaC10cmVuZHMtZm9yLWphbnVhcnktMjAyMS8zOTQwMDMv0gEA?oc=5,2021-01-28,google maps search trends january 2021 search engine journal,0.0,2021-01-28,92.1969985961914,94.94149780273438,92.13200378417967,93.15550231933594,93.04961395263672,35462000
Simulating Stock Prices using Python - DataDrivenInvestor,https://news.google.com/rss/articles/CBMiSmh0dHBzOi8vbWVkaXVtLmRhdGFkcml2ZW5pbnZlc3Rvci5jb20vc3RvY2stcHJpY2Utc2ltdWxhdGlvbnMtZmEyY2U0OTJkZDkz0gEA?oc=5,2021-01-28,simulating stock prices using python datadriveninvestor,0.0,2021-01-28,92.1969985961914,94.94149780273438,92.13200378417967,93.15550231933594,93.04961395263672,35462000
Robinhood Android app gets review-bombed over stock block - 9to5Google,https://news.google.com/rss/articles/CBMiSWh0dHBzOi8vOXRvNWdvb2dsZS5jb20vMjAyMS8wMS8yOC9yb2Jpbmhvb2QtYW5kcm9pZC1yZXZpZXctYm9tYi1nYW1lc3RvcC_SAQA?oc=5,2021-01-28,robinhood android app gets review bombed stock block 9to5google,0.0,2021-01-28,92.1969985961914,94.94149780273438,92.13200378417967,93.15550231933594,93.04961395263672,35462000
Robinhood users revolt after it stops trades of GameStop stock - Business Insider,https://news.google.com/rss/articles/CBMiXGh0dHBzOi8vd3d3LmJ1c2luZXNzaW5zaWRlci5jb20vZ2FtZXN0b3Atc3RvY2stdHJhZGluZy1yb2Jpbmhvb2QtdXNlcnMtY3JpdGljcy1yZXZvbHQtMjAyMS0x0gFgaHR0cHM6Ly93d3cuYnVzaW5lc3NpbnNpZGVyLmNvbS9nYW1lc3RvcC1zdG9jay10cmFkaW5nLXJvYmluaG9vZC11c2Vycy1jcml0aWNzLXJldm9sdC0yMDIxLTE_YW1w?oc=5,2021-01-28,robinhood users revolt stops trades gamestop stock business insider,0.0,2021-01-28,92.1969985961914,94.94149780273438,92.13200378417967,93.15550231933594,93.04961395263672,35462000
Robinhood GME traders ask Apple to remove it from App Store - 9to5Mac,https://news.google.com/rss/articles/CBMiQ2h0dHBzOi8vOXRvNW1hYy5jb20vMjAyMS8wMS8yOC9yb2Jpbmhvb2QtZ21lLXJlbW92ZS1mcm9tLWFwcC1zdG9yZS_SAQA?oc=5,2021-01-28,robinhood gme traders ask apple remove app store 9to5mac,0.0,2021-01-28,92.1969985961914,94.94149780273438,92.13200378417967,93.15550231933594,93.04961395263672,35462000
Explained: How an online forum called Reddit boosted a struggling company's stock by 1700 per cent - 9News,https://news.google.com/rss/articles/CBMif2h0dHBzOi8vd3d3LjluZXdzLmNvbS5hdS9uYXRpb25hbC9yZWRkaXQtd2FsbHN0cmVldGJldHMtZ2FtZXN0b3Atc3RvY2staW5mbGF0aW9uLWV4cGxhaW5lZC9mMGE4ODJjZC0xZDAxLTRjNzQtOTg5NS1mY2JlMWZmYjA3NjnSAUVodHRwczovL2FtcC45bmV3cy5jb20uYXUvYXJ0aWNsZS9mMGE4ODJjZC0xZDAxLTRjNzQtOTg5NS1mY2JlMWZmYjA3Njk?oc=5,2021-01-28,explained online forum called reddit boosted struggling company stock 1700 per cent 9news,0.0,2021-01-28,92.1969985961914,94.94149780273438,92.13200378417967,93.15550231933594,93.04961395263672,35462000
GameStop (GME) stock trade restrictions on Robinhood app provoke review bombing [UPDATED] - Shacknews,https://news.google.com/rss/articles/CBMifmh0dHBzOi8vd3d3LnNoYWNrbmV3cy5jb20vYXJ0aWNsZS8xMjI0NDIvZ2FtZXN0b3AtZ21lLXN0b2NrLXRyYWRlLXJlc3RyaWN0aW9ucy1vbi1yb2Jpbmhvb2QtYXBwLXByb3Zva2UtcmV2aWV3LWJvbWJpbmctdXBkYXRlZNIBiAFodHRwczovL3d3dy5zaGFja25ld3MuY29tL2FydGljbGUvMTIyNDQyL2dhbWVzdG9wLWdtZS1zdG9jay10cmFkZS1yZXN0cmljdGlvbnMtb24tcm9iaW5ob29kLWFwcC1wcm92b2tlLXJldmlldy1ib21iaW5nLXVwZGF0ZWQ_YW1waHRtbD0x?oc=5,2021-01-28,gamestop gme stock trade restrictions robinhood app provoke review bombing updated shacknews,0.0,2021-01-28,92.1969985961914,94.94149780273438,92.13200378417967,93.15550231933594,93.04961395263672,35462000
Wall Street Billionaire Leon Cooperman Warns Market Is 'Not Going To End Well'—But He Still Likes These 5 Investments - Forbes,https://news.google.com/rss/articles/CBMirgFodHRwczovL3d3dy5mb3JiZXMuY29tL3NpdGVzL3NlcmdlaWtsZWJuaWtvdi8yMDIxLzAxLzEyL3dhbGwtc3RyZWV0LWJpbGxpb25haXJlLWxlb24tY29vcGVybWFuLXdhcm5zLW1hcmtldC1pdHMtbm90LWdvaW5nLXRvLWVuZC13ZWxsLS1idXQtaGUtc3RpbGwtbGlrZXMtdGhlc2UtNS1pbnZlc3RtZW50cy_SAQA?oc=5,2021-01-12,wall street billionaire leon cooperman warns market going end well still likes 5 investments forbes,0.0,2021-01-12,87.69599914550781,88.9020004272461,86.2655029296875,87.32749938964844,87.22824096679688,27140000
Gamestop Stock Up 75% In One Day - Lords of Gaming,https://news.google.com/rss/articles/CBMiQmh0dHBzOi8vbG9yZHNvZmdhbWluZy5uZXQvMjAyMS8wMS9nYW1lc3RvcC1zdG9jay11cC03NS1pbi1vbmUtZGF5L9IBAA?oc=5,2021-01-22,gamestop stock 75 one day lords gaming,0.0,2021-01-22,94.78399658203124,95.54750061035156,94.08799743652344,95.05249786376952,94.9444580078125,25442000
